merge_candidate_id,document_id,page_no,primary_seed_id,primary_source_object_id,primary_block_type,item_label_draft,item_statement_draft,candidate_role_draft,candidate_role_notes,bucket_resource_type_guess,resource_type_candidates,primary_strategy_candidates,tech_domain_candidates,tech_subdomain_candidates,member_seed_ids,member_source_object_ids,member_count,supporting_review_seed_ids,supporting_review_count,primary_text,continuation_texts,supporting_review_texts,merge_confidence,merge_status,merge_notes
PMD-DOC-POL-005-0001,DOC-POL-005,section2,CLS-SEED-DOC-POL-005-00002,PAR-DOC-POL-005-00002,bullet,「과학기술로 미래를 선도하는 연구개발 생태계 혁신방안(안)」을 별지와 같이 의결함,ㅇ 「과학기술로 미래를 선도하는 연구개발 생태계 혁신방안(안)」을 별지와 같이 의결함,meta_program_frame,detected_program_frame_keyword,technology,technology,,,,CLS-SEED-DOC-POL-005-00002,PAR-DOC-POL-005-00002,1,,0,ㅇ 「과학기술로 미래를 선도하는 연구개발 생태계 혁신방안(안)」을 별지와 같이 의결함,,,medium,review_required,
PMD-DOC-POL-005-0002,DOC-POL-005,section2,CLS-SEED-DOC-POL-005-00004,PAR-DOC-POL-005-00004,bullet,훼손된 연구생태계의 복원을 넘어,"ㅇ 훼손된 연구생태계의 복원을 넘어, 연구자의 도전-몰입이 국가성장으로 이어지기 위한 실질적 대책을 담은 「과학기술로 미래를 선도하는 연구개발 생태계 혁신방안(안)」을 관계부처* 합동으로 수립‧시행하고자 함",policy_action,,talent,talent,,,,CLS-SEED-DOC-POL-005-00004,PAR-DOC-POL-005-00004,1,CLS-SEED-DOC-POL-005-00005,1,"ㅇ 훼손된 연구생태계의 복원을 넘어, 연구자의 도전-몰입이 국가성장으로 이어지기 위한 실질적 대책을 담은 「과학기술로 미래를 선도하는 연구개발 생태계 혁신방안(안)」을 관계부처* 합동으로 수립‧시행하고자 함",,"* 과학기술정보통신부, 기획재정부, 교육부, 산업통상부, 중소벤처기업부, 조달청 6개 부처(청)",medium,review_required,attached_review_support
PMD-DOC-POL-005-0003,DOC-POL-005,section2,CLS-SEED-DOC-POL-005-00007,PAR-DOC-POL-005-00007,bullet,추진 배경 및 경과,□ 추진 배경 및 경과,meta_program_frame,detected_program_frame_keyword,,,,,,CLS-SEED-DOC-POL-005-00007,PAR-DOC-POL-005-00007,1,,0,□ 추진 배경 및 경과,,,medium,review_required,
PMD-DOC-POL-005-0004,DOC-POL-005,section2,CLS-SEED-DOC-POL-005-00009,PAR-DOC-POL-005-00009,bullet,☞ 연구 생태계의 복원을 넘어,"☞ 연구 생태계의 복원을 넘어, 연구자의 도전·몰입이 국가성장으로 이어지기 위한 실질적 대책을 담은 ‘연구개발 생태계 혁신방안’ 마련 추진",policy_action,,,,,,,CLS-SEED-DOC-POL-005-00009,PAR-DOC-POL-005-00009,1,,0,"☞ 연구 생태계의 복원을 넘어, 연구자의 도전·몰입이 국가성장으로 이어지기 위한 실질적 대책을 담은 ‘연구개발 생태계 혁신방안’ 마련 추진",,,medium,review_required,
PMD-DOC-POL-005-0005,DOC-POL-005,section2,CLS-SEED-DOC-POL-005-00010,PAR-DOC-POL-005-00010,bullet,경과,ㅇ (경과) 과제의 발굴부터 해결방안 도출까지 철저하게 현장 중심으로 이루어지도록 다양한 방법*으로 과학기술계 의견 적극 청취-반영,policy_action,,technology,technology,,,,CLS-SEED-DOC-POL-005-00010,PAR-DOC-POL-005-00010,1,CLS-SEED-DOC-POL-005-00011,1,ㅇ (경과) 과제의 발굴부터 해결방안 도출까지 철저하게 현장 중심으로 이루어지도록 다양한 방법*으로 과학기술계 의견 적극 청취-반영,,"* ▲민간 전문가 자문단 구성-운영, ▲권역별-주제별 연구현장 간담회 개최(9회), ▲온라인 소통 플랫폼(모두의 R&D) 운영(7월∼10월), ▲대국민 보고회 개최(11.7.) 등",medium,review_required,attached_review_support
PMD-DOC-POL-005-0006,DOC-POL-005,section2,CLS-SEED-DOC-POL-005-00013,PAR-DOC-POL-005-00013,bullet,현장의 문제인식을 바탕으로,"ㅇ 현장의 문제인식을 바탕으로, 다음 세대의 꿈이 될 과학기술자가 나오기 어려운 현재 연구환경의 구조적 한계 분석 및 과제 도출",background_context,detected_background_keyword,,,,,,CLS-SEED-DOC-POL-005-00013,PAR-DOC-POL-005-00013,1,,0,"ㅇ 현장의 문제인식을 바탕으로, 다음 세대의 꿈이 될 과학기술자가 나오기 어려운 현재 연구환경의 구조적 한계 분석 및 과제 도출",,,medium,review_required,
PMD-DOC-POL-005-0007,DOC-POL-005,section2,CLS-SEED-DOC-POL-005-00014,PAR-DOC-POL-005-00014,bullet,연구자 중심,ㅇ (연구자 중심) 연구가 가장 최우선시되는 연구몰입 환경 구축,policy_action,,talent,talent,,,,CLS-SEED-DOC-POL-005-00014,PAR-DOC-POL-005-00014,1,,0,ㅇ (연구자 중심) 연구가 가장 최우선시되는 연구몰입 환경 구축,,,medium,review_required,
PMD-DOC-POL-005-0008,DOC-POL-005,section2,CLS-SEED-DOC-POL-005-00015,PAR-DOC-POL-005-00015,bullet,혁신주체 역량 제고,"ㅇ (혁신주체 역량 제고) 출연연, 대학, 기업 본연의 역할을 지원하는 체계",policy_action,,,,,,,CLS-SEED-DOC-POL-005-00015,PAR-DOC-POL-005-00015,1,,0,"ㅇ (혁신주체 역량 제고) 출연연, 대학, 기업 본연의 역할을 지원하는 체계",,,medium,review_required,
PMD-DOC-POL-005-0009,DOC-POL-005,section2,CLS-SEED-DOC-POL-005-00016,PAR-DOC-POL-005-00016,bullet,R&D기반 강화,ㅇ (R&D기반 강화) 연구자와 연구기관의 성장을 뒷받침하는 정부 시스템,policy_action,,talent,talent,,,,CLS-SEED-DOC-POL-005-00016,PAR-DOC-POL-005-00016,1,,0,ㅇ (R&D기반 강화) 연구자와 연구기관의 성장을 뒷받침하는 정부 시스템,,,medium,review_required,
PMD-DOC-POL-005-0010,DOC-POL-005,section2,CLS-SEED-DOC-POL-005-00017,PAR-DOC-POL-005-00017,bullet,추진 전략 및 과제,□ 추진 전략 및 과제,meta_program_frame,detected_program_frame_keyword,,,,,,CLS-SEED-DOC-POL-005-00017,PAR-DOC-POL-005-00017,1,,0,□ 추진 전략 및 과제,,,medium,review_required,
PMD-DOC-POL-005-0011,DOC-POL-005,section2,CLS-SEED-DOC-POL-005-00018,PAR-DOC-POL-005-00018,bullet,도전·창의적 연구에 몰입하는 환경 조성,- 도전·창의적 연구에 몰입하는 환경 조성,meta_program_frame,detected_short_meta_bullet,,,,,,CLS-SEED-DOC-POL-005-00018,PAR-DOC-POL-005-00018,1,,0,- 도전·창의적 연구에 몰입하는 환경 조성,,,medium,review_required,
PMD-DOC-POL-005-0012,DOC-POL-005,section2,CLS-SEED-DOC-POL-005-00020,PAR-DOC-POL-005-00020,bullet,현장의견 연구자가 목표달성 실패를 걱정으로 안전한 연구만 수행,ㅇ 현장의견 연구자가 목표달성 실패를 걱정으로 안전한 연구만 수행,background_context,detected_background_keyword,talent,talent,,,,CLS-SEED-DOC-POL-005-00020,PAR-DOC-POL-005-00020,1,,0,ㅇ 현장의견 연구자가 목표달성 실패를 걱정으로 안전한 연구만 수행,,,medium,review_required,
PMD-DOC-POL-005-0013,DOC-POL-005,section2,CLS-SEED-DOC-POL-005-00021,PAR-DOC-POL-005-00021,bullet,☞ 개선방향 도전-창의적 연구에만 몰입할 수 있도록 평가제도 혁신,☞ 개선방향 도전-창의적 연구에만 몰입할 수 있도록 평가제도 혁신,policy_action,detected_improvement_direction_prefix,infrastructure_policy,infrastructure_policy,,,,CLS-SEED-DOC-POL-005-00021,PAR-DOC-POL-005-00021,1,,0,☞ 개선방향 도전-창의적 연구에만 몰입할 수 있도록 평가제도 혁신,,,medium,review_required,
PMD-DOC-POL-005-0014,DOC-POL-005,section2,CLS-SEED-DOC-POL-005-00023,PAR-DOC-POL-005-00023,bullet,현장의견 연구자가 연구에 몰입하지 못하고 사전통제 중심 행정절차에 매몰,ㅇ 현장의견 연구자가 연구에 몰입하지 못하고 사전통제 중심 행정절차에 매몰,background_context,detected_background_keyword,talent,talent,,,,CLS-SEED-DOC-POL-005-00023,PAR-DOC-POL-005-00023,1,,0,ㅇ 현장의견 연구자가 연구에 몰입하지 못하고 사전통제 중심 행정절차에 매몰,,,medium,review_required,
PMD-DOC-POL-005-0015,DOC-POL-005,section2,CLS-SEED-DOC-POL-005-00024,PAR-DOC-POL-005-00024,bullet,☞ 개선방향 책임에 기반하여 연구자 자율성을 강화하고,"☞ 개선방향 책임에 기반하여 연구자 자율성을 강화하고, 불필요한 행정부담 완화 ➂ 연구 몰입과 성과 제고를 돕는 연구지원인력-장비활용 인프라 확충",policy_action,detected_improvement_direction_prefix,talent,talent,,,,CLS-SEED-DOC-POL-005-00024 | CLS-SEED-DOC-POL-005-00025,PAR-DOC-POL-005-00024 | PAR-DOC-POL-005-00025,2,,0,"☞ 개선방향 책임에 기반하여 연구자 자율성을 강화하고, 불필요한 행정부담 완화",➂ 연구 몰입과 성과 제고를 돕는 연구지원인력-장비활용 인프라 확충,,medium,review_required,attached_continuation
PMD-DOC-POL-005-0016,DOC-POL-005,section2,CLS-SEED-DOC-POL-005-00027,PAR-DOC-POL-005-00027,bullet,☞ 개선방향 연구지원체계를 기관 중심으로 전환하고 장비 공동활용-도입 제도 개선,☞ 개선방향 연구지원체계를 기관 중심으로 전환하고 장비 공동활용-도입 제도 개선,policy_action,detected_improvement_direction_prefix,infrastructure_policy,infrastructure_policy,,,,CLS-SEED-DOC-POL-005-00027,PAR-DOC-POL-005-00027,1,,0,☞ 개선방향 연구지원체계를 기관 중심으로 전환하고 장비 공동활용-도입 제도 개선,,,medium,review_required,
PMD-DOC-POL-005-0017,DOC-POL-005,section2,CLS-SEED-DOC-POL-005-00028,PAR-DOC-POL-005-00028,bullet,출연연-대학-기업에 맞는 지원체계,- 출연연-대학-기업에 맞는 지원체계,meta_program_frame,detected_short_meta_bullet,infrastructure_policy,infrastructure_policy,,,,CLS-SEED-DOC-POL-005-00028,PAR-DOC-POL-005-00028,1,,0,- 출연연-대학-기업에 맞는 지원체계,,,medium,review_required,
PMD-DOC-POL-005-0018,DOC-POL-005,section2,CLS-SEED-DOC-POL-005-00030,PAR-DOC-POL-005-00030,bullet,현장의견 파편화된 재정구조,"ㅇ 현장의견 파편화된 재정구조, 우수인재 유입 약화로 국가적 임무 수행에 제한",background_context,detected_background_keyword,talent,talent,,,,CLS-SEED-DOC-POL-005-00030,PAR-DOC-POL-005-00030,1,,0,"ㅇ 현장의견 파편화된 재정구조, 우수인재 유입 약화로 국가적 임무 수행에 제한",,,medium,review_required,
PMD-DOC-POL-005-0019,DOC-POL-005,section2,CLS-SEED-DOC-POL-005-00031,PAR-DOC-POL-005-00031,bullet,☞ 개선방향 출연연 시스템을 임무중심으로 전환하고 연구자 처우-채용제도 개선,☞ 개선방향 출연연 시스템을 임무중심으로 전환하고 연구자 처우-채용제도 개선,policy_action,detected_improvement_direction_prefix,talent,talent,,,,CLS-SEED-DOC-POL-005-00031,PAR-DOC-POL-005-00031,1,,0,☞ 개선방향 출연연 시스템을 임무중심으로 전환하고 연구자 처우-채용제도 개선,,,medium,review_required,
PMD-DOC-POL-005-0020,DOC-POL-005,section2,CLS-SEED-DOC-POL-005-00034,PAR-DOC-POL-005-00034,bullet,☞ 개선방향 블록펀딩 도입,"☞ 개선방향 블록펀딩 도입, 기초연구 복원 및 지역거점대 연구경쟁력 제고 ➅ 맞춤형 기업 지원으로 민간 혁신 활성화",policy_action,detected_improvement_direction_prefix,,,,,,CLS-SEED-DOC-POL-005-00034 | CLS-SEED-DOC-POL-005-00035,PAR-DOC-POL-005-00034 | PAR-DOC-POL-005-00035,2,,0,"☞ 개선방향 블록펀딩 도입, 기초연구 복원 및 지역거점대 연구경쟁력 제고",➅ 맞춤형 기업 지원으로 민간 혁신 활성화,,medium,review_required,attached_continuation
PMD-DOC-POL-005-0021,DOC-POL-005,section2,CLS-SEED-DOC-POL-005-00036,PAR-DOC-POL-005-00036,bullet,현장의견 공급자 중심 정책 지원으로,"ㅇ 현장의견 공급자 중심 정책 지원으로, 기업이 체감할 수 있는 혜택-지원 부재",problem_or_requirement,detected_problem_keyword,,,,,,CLS-SEED-DOC-POL-005-00036,PAR-DOC-POL-005-00036,1,,0,"ㅇ 현장의견 공급자 중심 정책 지원으로, 기업이 체감할 수 있는 혜택-지원 부재",,,medium,review_required,
PMD-DOC-POL-005-0022,DOC-POL-005,section2,CLS-SEED-DOC-POL-005-00037,PAR-DOC-POL-005-00037,bullet,☞ 개선방향 체감이 가능한 인센티브 도입 및 기업 역량에 따라 지원방식 다양화,☞ 개선방향 체감이 가능한 인센티브 도입 및 기업 역량에 따라 지원방식 다양화,policy_action,detected_improvement_direction_prefix,,,,,,CLS-SEED-DOC-POL-005-00037,PAR-DOC-POL-005-00037,1,,0,☞ 개선방향 체감이 가능한 인센티브 도입 및 기업 역량에 따라 지원방식 다양화,,,medium,review_required,
PMD-DOC-POL-005-0023,DOC-POL-005,section2,CLS-SEED-DOC-POL-005-00040,PAR-DOC-POL-005-00040,bullet,현장의견 재정 효율성 중심 투자시스템으로 인해 안정적이고 신속한 R&D 투자 제한,ㅇ 현장의견 재정 효율성 중심 투자시스템으로 인해 안정적이고 신속한 R&D 투자 제한,background_context,detected_background_keyword,,,,,,CLS-SEED-DOC-POL-005-00040,PAR-DOC-POL-005-00040,1,,0,ㅇ 현장의견 재정 효율성 중심 투자시스템으로 인해 안정적이고 신속한 R&D 투자 제한,,,medium,review_required,
PMD-DOC-POL-005-0024,DOC-POL-005,section2,CLS-SEED-DOC-POL-005-00041,PAR-DOC-POL-005-00041,bullet,☞ 개선방향 충분한 R&D 투자 규모 확보 및 신속-유연한 투자체계로 전환,☞ 개선방향 충분한 R&D 투자 규모 확보 및 신속-유연한 투자체계로 전환,policy_action,detected_improvement_direction_prefix,technology,technology,,,,CLS-SEED-DOC-POL-005-00041,PAR-DOC-POL-005-00041,1,,0,☞ 개선방향 충분한 R&D 투자 규모 확보 및 신속-유연한 투자체계로 전환,,,medium,review_required,
PMD-DOC-POL-005-0025,DOC-POL-005,section2,CLS-SEED-DOC-POL-005-00044,PAR-DOC-POL-005-00044,bullet,☞ 개선방향 민간전문성,"☞ 개선방향 민간전문성, AI활용 등으로 연구 기획-평가-관리 체계 고도화 ➈ 연구성과의 확산과 개발기술의 사업화 촉진",policy_action,detected_improvement_direction_prefix,technology,technology,,,,CLS-SEED-DOC-POL-005-00044 | CLS-SEED-DOC-POL-005-00045,PAR-DOC-POL-005-00044 | PAR-DOC-POL-005-00045,2,,0,"☞ 개선방향 민간전문성, AI활용 등으로 연구 기획-평가-관리 체계 고도화",➈ 연구성과의 확산과 개발기술의 사업화 촉진,,medium,review_required,attached_continuation
PMD-DOC-POL-005-0026,DOC-POL-005,section2,CLS-SEED-DOC-POL-005-00046,PAR-DOC-POL-005-00046,bullet,현장의견 축적된 연구성과-개발기술의 확산을 위한 체계적인 시스템 부재,ㅇ 현장의견 축적된 연구성과-개발기술의 확산을 위한 체계적인 시스템 부재,problem_or_requirement,detected_problem_keyword,technology,technology,,,,CLS-SEED-DOC-POL-005-00046,PAR-DOC-POL-005-00046,1,,0,ㅇ 현장의견 축적된 연구성과-개발기술의 확산을 위한 체계적인 시스템 부재,,,medium,review_required,
PMD-DOC-POL-005-0027,DOC-POL-005,section2,CLS-SEED-DOC-POL-005-00047,PAR-DOC-POL-005-00047,bullet,☞ 개선방향 연구-개발성과가 시장으로,"☞ 개선방향 연구-개발성과가 시장으로, 연구데이터가 다음 연구로 이어지는 체계 구축",policy_action,detected_improvement_direction_prefix,technology,technology,,,,CLS-SEED-DOC-POL-005-00047,PAR-DOC-POL-005-00047,1,,0,"☞ 개선방향 연구-개발성과가 시장으로, 연구데이터가 다음 연구로 이어지는 체계 구축",,,medium,review_required,
PMD-DOC-POL-005-0028,DOC-POL-005,section2,CLS-SEED-DOC-POL-005-00050,PAR-DOC-POL-005-00050,bullet,부처별 추진과제 이행 실적을 주기적으로 점검,ㅇ 부처별 추진과제 이행 실적을 주기적으로 점검,policy_action,,,,,,,CLS-SEED-DOC-POL-005-00050,PAR-DOC-POL-005-00050,1,CLS-SEED-DOC-POL-005-00051,1,ㅇ 부처별 추진과제 이행 실적을 주기적으로 점검,,※ 필요시 과학기술관계장관회의를 통하여 부처 간 정책 조정,medium,review_required,attached_review_support
PMD-DOC-POL-005-0029,DOC-POL-005,section5,CLS-SEED-DOC-POL-005-00056,PAR-DOC-POL-005-00056,bullet,미래사회에 큰 영향을 미칠 AI,"ㅇ 미래사회에 큰 영향을 미칠 AI, 바이오, 양자 등 첨단 과학기술에 대한 글로벌 각국의 기술주도권 확보 경쟁*이 치열한 상황",policy_action,,technology,technology | infrastructure_policy,STR-007 | STR-001,TD-010,TSD-010-004,CLS-SEED-DOC-POL-005-00056,PAR-DOC-POL-005-00056,1,CLS-SEED-DOC-POL-005-00057,1,"ㅇ 미래사회에 큰 영향을 미칠 AI, 바이오, 양자 등 첨단 과학기술에 대한 글로벌 각국의 기술주도권 확보 경쟁*이 치열한 상황",,"* (미) 스타게이트프로젝트, AI데이터 센터 5천억달러 (EU) InvestAI 이니셔티브, 약 2천억유로 (중) 국가창업투자유도펀드 1조 위안, 첨단기술 분야 기업 투자",medium,review_required,attached_review_support
PMD-DOC-POL-005-0030,DOC-POL-005,section5,CLS-SEED-DOC-POL-005-00058,PAR-DOC-POL-005-00058,bullet,우리나라는 잠재성장률이 급격히 둔화* 중이나 인구절벽으로 노동투입 확대도 어려워,"ㅇ 우리나라는 잠재성장률이 급격히 둔화* 중이나 인구절벽으로 노동투입 확대도 어려워, R&D를 통한 새로운 가치 창출과 생산성 혁신만이 해법",policy_action,,,,,,,CLS-SEED-DOC-POL-005-00058,PAR-DOC-POL-005-00058,1,CLS-SEED-DOC-POL-005-00059,1,"ㅇ 우리나라는 잠재성장률이 급격히 둔화* 중이나 인구절벽으로 노동투입 확대도 어려워, R&D를 통한 새로운 가치 창출과 생산성 혁신만이 해법",,"* 잠재성장률 전망: ’25~’30, 1.5% → ’31~’40, 0.7% → ’41~’50, 0.1% (KDI, ’25.5.)",medium,review_required,attached_review_support
PMD-DOC-POL-005-0031,DOC-POL-005,section5,CLS-SEED-DOC-POL-005-00061,PAR-DOC-POL-005-00061,bullet,과제의 발굴부터 해결방안 도출까지 철저하게 현장 중심으로 이루어지도록 다양한 방법으로 과학기술계 의견...,□ 과제의 발굴부터 해결방안 도출까지 철저하게 현장 중심으로 이루어지도록 다양한 방법으로 과학기술계 의견 적극 청취-반영,policy_action,,technology,technology,,,,CLS-SEED-DOC-POL-005-00061,PAR-DOC-POL-005-00061,1,CLS-SEED-DOC-POL-005-00062,1,□ 과제의 발굴부터 해결방안 도출까지 철저하게 현장 중심으로 이루어지도록 다양한 방법으로 과학기술계 의견 적극 청취-반영,,"※ 이재명 정부의 국정원칙: 경청과 통합, 공정과 신뢰, 실용과 성과",medium,review_required,attached_review_support
PMD-DOC-POL-005-0032,DOC-POL-005,section5,CLS-SEED-DOC-POL-005-00063,PAR-DOC-POL-005-00063,bullet,이슈 발굴→원인 진단→대안 도출 전 과정에 주도적으로 참여하는 민간 전문가 자문단 구성·운영,ㅇ 이슈 발굴→원인 진단→대안 도출 전 과정에 주도적으로 참여하는 민간 전문가 자문단 구성·운영,policy_action,,,,,,,CLS-SEED-DOC-POL-005-00063,PAR-DOC-POL-005-00063,1,CLS-SEED-DOC-POL-005-00064,1,ㅇ 이슈 발굴→원인 진단→대안 도출 전 과정에 주도적으로 참여하는 민간 전문가 자문단 구성·운영,,"※ 산·학·연 민간전문가 17인으로 구성, 대면회의 총 4회 개최",medium,review_required,attached_review_support
PMD-DOC-POL-005-0033,DOC-POL-005,section5,CLS-SEED-DOC-POL-005-00065,PAR-DOC-POL-005-00065,bullet,연구현장의 문제 인식,"ㅇ 연구현장의 문제 인식, 개선요청 사항 등을 가감 없이 듣기 위한 권역별(5극)/주제별(평가, 제도, 장비 등) 연구 현장 간담회 9회 개최",policy_action,detected_soft_problem_but_action_overrides,,,,,,CLS-SEED-DOC-POL-005-00065,PAR-DOC-POL-005-00065,1,CLS-SEED-DOC-POL-005-00066,1,"ㅇ 연구현장의 문제 인식, 개선요청 사항 등을 가감 없이 듣기 위한 권역별(5극)/주제별(평가, 제도, 장비 등) 연구 현장 간담회 9회 개최",,"※ 그 외, 과제 도출 및 대안 발굴을 위한 분야별 현장소통 23회 이상 실시",medium,review_required,attached_review_support
PMD-DOC-POL-005-0034,DOC-POL-005,section5,CLS-SEED-DOC-POL-005-00067,PAR-DOC-POL-005-00067,bullet,일반국민을 포함,"ㅇ 일반국민을 포함, 현장의 의견을 최대한으로 수렴하기 위하여 온라인 소통 플랫폼인 ‘모두의 R&D’운영",policy_action,,technology,technology | talent,,,,CLS-SEED-DOC-POL-005-00067,PAR-DOC-POL-005-00067,1,CLS-SEED-DOC-POL-005-00071,1,"ㅇ 일반국민을 포함, 현장의 의견을 최대한으로 수렴하기 위하여 온라인 소통 플랫폼인 ‘모두의 R&D’운영",,"※ 초등학생 희망 직업 : 1위 운동선수 / 2위 의사 / 과학기술자는 20위권 밖(교육부, 2024)",medium,review_required,attached_review_support
PMD-DOC-POL-005-0035,DOC-POL-005,section5,CLS-SEED-DOC-POL-005-00075,PAR-DOC-POL-005-00075,bullet,복잡한 행정절차 등 정작 연구에 대한 몰입을 방해하는 제도,ㅇ 복잡한 행정절차 등 정작 연구에 대한 몰입을 방해하는 제도,policy_action,,infrastructure_policy,infrastructure_policy,,,,CLS-SEED-DOC-POL-005-00075,PAR-DOC-POL-005-00075,1,,0,ㅇ 복잡한 행정절차 등 정작 연구에 대한 몰입을 방해하는 제도,,,medium,review_required,
PMD-DOC-POL-005-0036,DOC-POL-005,section5,CLS-SEED-DOC-POL-005-00077,PAR-DOC-POL-005-00077,bullet,연구개발(R&D)이 국가적-세계적 인정을 받을 만한 지적-경제적 성과로 이어지기 어려운 환경,ㅇ 연구개발(R&D)이 국가적-세계적 인정을 받을 만한 지적-경제적 성과로 이어지기 어려운 환경,policy_action,,technology,technology,STR-015,,,CLS-SEED-DOC-POL-005-00077,PAR-DOC-POL-005-00077,1,CLS-SEED-DOC-POL-005-00080 | CLS-SEED-DOC-POL-005-00082,2,ㅇ 연구개발(R&D)이 국가적-세계적 인정을 받을 만한 지적-경제적 성과로 이어지기 어려운 환경,,"* 혁신법 도입('21)으로 성공-실패의 분류 기준은 없으나, 현재 4단계 과제 평가결과 등급(우수–보통-미흡-극히불량)에 따라 분류 || * (사례) 당초 암 치료제로 개발 중이던 mRNA의약품은 초기연구가 다수 실패했으나, 축적된 기술로 코로나19 팬데믹에서 mRNA 백신으로 임상·산업적 성공",medium,review_required,attached_review_support
PMD-DOC-POL-005-0037,DOC-POL-005,section5,CLS-SEED-DOC-POL-005-00083,PAR-DOC-POL-005-00083,bullet,고위험 연구수행 이력에 대한 포상,"- 고위험 연구수행 이력에 대한 포상, 후속연구 지원 등도 미흡",problem_or_requirement,detected_problem_keyword,,,,,,CLS-SEED-DOC-POL-005-00083,PAR-DOC-POL-005-00083,1,,0,"- 고위험 연구수행 이력에 대한 포상, 후속연구 지원 등도 미흡",,,medium,review_required,
PMD-DOC-POL-005-0038,DOC-POL-005,section5,CLS-SEED-DOC-POL-005-00085,PAR-DOC-POL-005-00085,bullet,공정성 우려,"ㅇ 공정성 우려, 제한된 일정과 비용 등으로 인한 형식적 평가체계는 피평가자가 공감할 수 있는 전문적이고 심도있는 결과 도출에 한계",background_context,detected_background_keyword,technology,technology,,,,CLS-SEED-DOC-POL-005-00085,PAR-DOC-POL-005-00085,1,,0,"ㅇ 공정성 우려, 제한된 일정과 비용 등으로 인한 형식적 평가체계는 피평가자가 공감할 수 있는 전문적이고 심도있는 결과 도출에 한계",,,medium,review_required,
PMD-DOC-POL-005-0039,DOC-POL-005,section5,CLS-SEED-DOC-POL-005-00086,PAR-DOC-POL-005-00086,bullet,연구내용의 의의와 파급효과(Out-come)보다 단순 산출물(Out-put) 중심의 평가에서 연구자들은...,ㅇ 연구내용의 의의와 파급효과(Out-come)보다 단순 산출물(Out-put) 중심의 평가에서 연구자들은 도전적 시도보다 가시적인 목표 달성에 치중,policy_action,,talent,talent,,,,CLS-SEED-DOC-POL-005-00086,PAR-DOC-POL-005-00086,1,,0,ㅇ 연구내용의 의의와 파급효과(Out-come)보다 단순 산출물(Out-put) 중심의 평가에서 연구자들은 도전적 시도보다 가시적인 목표 달성에 치중,,,medium,review_required,
PMD-DOC-POL-005-0040,DOC-POL-005,section5,CLS-SEED-DOC-POL-005-00087,PAR-DOC-POL-005-00087,bullet,논문-특허를 정량적으로 평가하지 않도록 평가체계를 개선해오고 있으나,"- 논문-특허를 정량적으로 평가하지 않도록 평가체계를 개선해오고 있으나, 일부 과제에서는 여전히 정량평가를 진행하여 현장 체감이 어려움",problem_or_requirement,detected_problem_keyword,,,,,,CLS-SEED-DOC-POL-005-00087,PAR-DOC-POL-005-00087,1,,0,"- 논문-특허를 정량적으로 평가하지 않도록 평가체계를 개선해오고 있으나, 일부 과제에서는 여전히 정량평가를 진행하여 현장 체감이 어려움",,,medium,review_required,
PMD-DOC-POL-005-0041,DOC-POL-005,section5,CLS-SEED-DOC-POL-005-00088,PAR-DOC-POL-005-00088,bullet,과도한 행정절차,□ (과도한 행정절차) 연구지원체계가 연구자에 대한 신뢰보다는 관리 편의주의 중심으로 운영되며 과도한 규정·절차가 누적되어 연구몰입 저해,policy_action,,technology,technology,,,,CLS-SEED-DOC-POL-005-00088,PAR-DOC-POL-005-00088,1,CLS-SEED-DOC-POL-005-00089,1,□ (과도한 행정절차) 연구지원체계가 연구자에 대한 신뢰보다는 관리 편의주의 중심으로 운영되며 과도한 규정·절차가 누적되어 연구몰입 저해,,※ 연구비 사용용도와 기준이 117개조로 복잡하게 구성(국가연구개발비 사용 기준 고시),medium,review_required,attached_review_support
