merge_candidate_id,document_id,page_no,primary_seed_id,primary_source_object_id,primary_block_type,item_label_draft,item_statement_draft,candidate_role_draft,candidate_role_notes,bucket_resource_type_guess,resource_type_candidates,primary_strategy_candidates,tech_domain_candidates,tech_subdomain_candidates,member_seed_ids,member_source_object_ids,member_count,supporting_review_seed_ids,supporting_review_count,primary_text,continuation_texts,supporting_review_texts,merge_confidence,merge_status,merge_notes
PMD-DOC-POL-005-0139,DOC-POL-005,section5,CLS-SEED-DOC-POL-005-00299,PAR-DOC-POL-005-00299,bullet,기업의 특성과 수요를 고려하여 지원 효과성 제고,□ 기업의 특성과 수요를 고려하여 지원 효과성 제고,policy_action,,,,,,,CLS-SEED-DOC-POL-005-00299,PAR-DOC-POL-005-00299,1,,0,□ 기업의 특성과 수요를 고려하여 지원 효과성 제고,,,medium,review_required,
PMD-DOC-POL-005-0140,DOC-POL-005,section5,CLS-SEED-DOC-POL-005-00300,PAR-DOC-POL-005-00300,bullet,혁신역량 진단,"ㅇ (혁신역량 진단) 기업부설연구소 R&D 역량 진단 모델을 고도화*하고, 혁신 역량 및 성장 단계 등을 고려한 맞춤형 케어를 지원",policy_action,,technology,technology | infrastructure_policy,,,,CLS-SEED-DOC-POL-005-00300,PAR-DOC-POL-005-00300,1,CLS-SEED-DOC-POL-005-00301 | CLS-SEED-DOC-POL-005-00302,2,"ㅇ (혁신역량 진단) 기업부설연구소 R&D 역량 진단 모델을 고도화*하고, 혁신 역량 및 성장 단계 등을 고려한 맞춤형 케어를 지원",,"* 기술혁신 프로세스(R&D 기획 및 관리 체계), 산학연 협력수준, 디지털 R&D 역량(DX/AX 등) || ※ ｢기업부설연구소법(’26.2~)｣를 통해 지원전담센터 설립 및 맞춤형 케어를 지원",medium,review_required,attached_review_support
PMD-DOC-POL-005-0141,DOC-POL-005,section5,CLS-SEED-DOC-POL-005-00303,PAR-DOC-POL-005-00303,bullet,기업 R&D 정보분석을 통해 역량진단 및 문제점을 파악하고,"- 기업 R&D 정보분석을 통해 역량진단 및 문제점을 파악하고, 맞춤기술-인력지원과 성과 사업화에 이르는 토탈케어 추진",policy_action,detected_soft_problem_but_action_overrides,talent,talent,,,,CLS-SEED-DOC-POL-005-00303,PAR-DOC-POL-005-00303,1,,0,"- 기업 R&D 정보분석을 통해 역량진단 및 문제점을 파악하고, 맞춤기술-인력지원과 성과 사업화에 이르는 토탈케어 추진",,,medium,review_required,
PMD-DOC-POL-005-0142,DOC-POL-005,section5,CLS-SEED-DOC-POL-005-00304,PAR-DOC-POL-005-00304,bullet,지원방식 다양화,"ㅇ (지원방식 다양화) 대학(자율성)‧출연연(임무중심형)에 최적화된 기존 지원방식에서 벗어나, 기업의 특성을 고려하여 지원방식 다양화",policy_action,,,,,,,CLS-SEED-DOC-POL-005-00304,PAR-DOC-POL-005-00304,1,,0,"ㅇ (지원방식 다양화) 대학(자율성)‧출연연(임무중심형)에 최적화된 기존 지원방식에서 벗어나, 기업의 특성을 고려하여 지원방식 다양화",,,medium,review_required,
PMD-DOC-POL-005-0143,DOC-POL-005,section5,CLS-SEED-DOC-POL-005-00305,PAR-DOC-POL-005-00305,bullet,기업의 역량,"- 기업의 역량, 기술 분야 등 유형에 따라 토너먼트형, 역매칭형, 투자-융자 연계형 등 다양한 지원방식 적용 유도",policy_action,,,,,,,CLS-SEED-DOC-POL-005-00305,PAR-DOC-POL-005-00305,1,CLS-SEED-DOC-POL-005-00307,1,"- 기업의 역량, 기술 분야 등 유형에 따라 토너먼트형, 역매칭형, 투자-융자 연계형 등 다양한 지원방식 적용 유도",,"* R&D 역량(혁신역량진단모델), 수익창출역량(TCB 평가 등급) 등을 통해 기업의 상황을 종합적으로 고려하여 적합한 지원 방안 도출",medium,review_required,attached_review_support
PMD-DOC-POL-005-0144,DOC-POL-005,section5,CLS-SEED-DOC-POL-005-00309,PAR-DOC-POL-005-00309,bullet,자율적 AX연구 지원,ㅇ (자율적 AX연구 지원) 미래 유망 산업 분야 기업들이 AI 솔루션 보유기업 협업을 토대로 기술-서비스를 자율 개발토록 지원하는 R&D 도입(’26~),policy_action,,technology,technology,STR-001,TD-001,TSD-001-007,CLS-SEED-DOC-POL-005-00309,PAR-DOC-POL-005-00309,1,,0,ㅇ (자율적 AX연구 지원) 미래 유망 산업 분야 기업들이 AI 솔루션 보유기업 협업을 토대로 기술-서비스를 자율 개발토록 지원하는 R&D 도입(’26~),,,medium,review_required,
PMD-DOC-POL-005-0145,DOC-POL-005,section5,CLS-SEED-DOC-POL-005-00310,PAR-DOC-POL-005-00310,bullet,12대 전략기술분야 중심으로 신속히 제품을 개발-출시할 수 있도록 컨소시엄을 선정-지원하되,"- 12대 전략기술분야 중심으로 신속히 제품을 개발-출시할 수 있도록 컨소시엄을 선정-지원하되, 조기 실현이 검증되면 2차년도까지 지원",policy_action,,technology,technology,,,,CLS-SEED-DOC-POL-005-00310,PAR-DOC-POL-005-00310,1,,0,"- 12대 전략기술분야 중심으로 신속히 제품을 개발-출시할 수 있도록 컨소시엄을 선정-지원하되, 조기 실현이 검증되면 2차년도까지 지원",,,medium,review_required,
PMD-DOC-POL-005-0146,DOC-POL-005,section5,CLS-SEED-DOC-POL-005-00311,PAR-DOC-POL-005-00311,bullet,전략기술 육성,ㅇ (전략기술 육성) ｢조특법｣ 상 세제지원 대상을 ｢국가전략기술육성법｣ 상 12대 전략기술 분야와 단계적 연계 강화하여 전략기술 육성 지원,policy_action,,infrastructure_policy,infrastructure_policy,,,,CLS-SEED-DOC-POL-005-00311,PAR-DOC-POL-005-00311,1,,0,ㅇ (전략기술 육성) ｢조특법｣ 상 세제지원 대상을 ｢국가전략기술육성법｣ 상 12대 전략기술 분야와 단계적 연계 강화하여 전략기술 육성 지원,,,medium,review_required,
PMD-DOC-POL-005-0147,DOC-POL-005,section5,CLS-SEED-DOC-POL-005-00313,PAR-DOC-POL-005-00313,bullet,민-관 소통확대,"ㅇ (민-관 소통확대) 연구개발비, 투자 세액공제 등 세제지원 논의*를 위한 소통 강화방안(기재부, 과기부, 산업부, 중기부, 산업계 등) 검토",policy_action,,technology,technology,,,,CLS-SEED-DOC-POL-005-00313,PAR-DOC-POL-005-00313,1,CLS-SEED-DOC-POL-005-00314,1,"ㅇ (민-관 소통확대) 연구개발비, 투자 세액공제 등 세제지원 논의*를 위한 소통 강화방안(기재부, 과기부, 산업부, 중기부, 산업계 등) 검토",,"* 국가전략기술, 신성장·원천기술 및 연구개발비 범위 등 논의",medium,review_required,attached_review_support
PMD-DOC-POL-005-0148,DOC-POL-005,section5,CLS-SEED-DOC-POL-005-00315,PAR-DOC-POL-005-00315,bullet,제품 단위 실증 R&D를 통한 기업의 혁신 성장 지원,□ 제품 단위 실증 R&D를 통한 기업의 혁신 성장 지원,policy_action,,technology,technology,,,,CLS-SEED-DOC-POL-005-00315,PAR-DOC-POL-005-00315,1,,0,□ 제품 단위 실증 R&D를 통한 기업의 혁신 성장 지원,,,medium,review_required,
PMD-DOC-POL-005-0149,DOC-POL-005,section5,CLS-SEED-DOC-POL-005-00316,PAR-DOC-POL-005-00316,bullet,대‧중소 상생협력,ㅇ (대‧중소 상생협력) 대기업과 중견‧중소기업의 상생협력*을 위해 수요자 참여형 실증 R&D 지원 확대 및 제도 마련,policy_action,,technology,technology,,,,CLS-SEED-DOC-POL-005-00316,PAR-DOC-POL-005-00316,1,CLS-SEED-DOC-POL-005-00317,1,ㅇ (대‧중소 상생협력) 대기업과 중견‧중소기업의 상생협력*을 위해 수요자 참여형 실증 R&D 지원 확대 및 제도 마련,,"* (대기업) 공급망 안정화, (중견‧중소기업) 실증 트랙 레코드 확보",medium,review_required,attached_review_support
PMD-DOC-POL-005-0150,DOC-POL-005,section5,CLS-SEED-DOC-POL-005-00318,PAR-DOC-POL-005-00318,bullet,대기업에서 공급망 수요를 기반으로 실증 환경을 제공하고,"- 대기업에서 공급망 수요를 기반으로 실증 환경을 제공하고, 중견‧중소 기업의 소재‧부품‧장비 혁신을 지원하는 상생형 실증 R&D 확대",policy_action,,technology,technology,,TD-005,,CLS-SEED-DOC-POL-005-00318,PAR-DOC-POL-005-00318,1,CLS-SEED-DOC-POL-005-00319,1,"- 대기업에서 공급망 수요를 기반으로 실증 환경을 제공하고, 중견‧중소 기업의 소재‧부품‧장비 혁신을 지원하는 상생형 실증 R&D 확대",,※ 수월성을 기반으로 대‧중소기업이 자발적으로 협력할 수 있는 상생 협력 사업 지원,medium,review_required,attached_review_support
PMD-DOC-POL-005-0151,DOC-POL-005,section5,CLS-SEED-DOC-POL-005-00320,PAR-DOC-POL-005-00320,bullet,기업의 실증 기회 확대를 위한 지역 테크노파크 등 공공 연구시설 지원*‧활용 강화,- 기업의 실증 기회 확대를 위한 지역 테크노파크 등 공공 연구시설 지원*‧활용 강화,policy_action,,technology,technology,,,,CLS-SEED-DOC-POL-005-00320,PAR-DOC-POL-005-00320,1,CLS-SEED-DOC-POL-005-00321,1,- 기업의 실증 기회 확대를 위한 지역 테크노파크 등 공공 연구시설 지원*‧활용 강화,,"※ 테크노파크 생산장비 고도화(지역특화산업육성, 중기부, ‘24~) 등",medium,review_required,attached_review_support
PMD-DOC-POL-005-0152,DOC-POL-005,section5,CLS-SEED-DOC-POL-005-00322,PAR-DOC-POL-005-00322,bullet,자율적인 상생 협력이 확대될 수 있도록 참여 대기업에게는 합리적 수준의 보상체계*를 도입,- 자율적인 상생 협력이 확대될 수 있도록 참여 대기업에게는 합리적 수준의 보상체계*를 도입,policy_action,,technology,technology,,,,CLS-SEED-DOC-POL-005-00322,PAR-DOC-POL-005-00322,1,CLS-SEED-DOC-POL-005-00323,1,- 자율적인 상생 협력이 확대될 수 있도록 참여 대기업에게는 합리적 수준의 보상체계*를 도입,,"* (예) 참여 수요기업에게 실증 결과물에 대한 우선 실시권 보장, 대기업 참여 부담금 완화, ‘파일럿 바우처 사업’ 도입을 통해 실증 환경 제공 대기업에 직접적 혜택 제공 등",medium,review_required,attached_review_support
PMD-DOC-POL-005-0153,DOC-POL-005,section5,CLS-SEED-DOC-POL-005-00325,PAR-DOC-POL-005-00325,bullet,우수기술 수요 확보를 위해 旣지정 혁신제품*의 홍보 및 국내‧외 판로개척 및 조달 이후 실증정보**를...,- 우수기술 수요 확보를 위해 旣지정 혁신제품*의 홍보 및 국내‧외 판로개척 및 조달 이후 실증정보**를 활용한 제품 고도화 추가 지원,policy_action,,technology,technology,,,,CLS-SEED-DOC-POL-005-00325,PAR-DOC-POL-005-00325,1,CLS-SEED-DOC-POL-005-00326 | CLS-SEED-DOC-POL-005-00327,2,- 우수기술 수요 확보를 위해 旣지정 혁신제품*의 홍보 및 국내‧외 판로개척 및 조달 이후 실증정보**를 활용한 제품 고도화 추가 지원,,"* 정부 R&D 결과물 중 공공성-혁신성이 인정되어 지정된 제품 등에 대해 공공조달 시 수의계약 가능, 중앙행정기관-공공기관 등에 혁신제품 구매 목표액 부여 등 혜택 제공 중 || ** 구매‧이용기관의 개선 요구사항, 문제해결 보완 필요점 등 기술고도화 후속 R&D 수요",medium,review_required,attached_review_support
PMD-DOC-POL-005-0154,DOC-POL-005,section5,CLS-SEED-DOC-POL-005-00329,PAR-DOC-POL-005-00329,bullet,R&D 투자시스템 혁신,"ㅇ (R&D 투자시스템 혁신) 훼손된 연구생태계 복원을 위해 매년 정부 총지출 대비 5% 수준으로 R&D 예산 확대 노력, R&D 예산 심의의 전문성·전략성 제고",policy_action,,infrastructure_policy,infrastructure_policy,,,,CLS-SEED-DOC-POL-005-00329,PAR-DOC-POL-005-00329,1,CLS-SEED-DOC-POL-005-00330,1,"ㅇ (R&D 투자시스템 혁신) 훼손된 연구생태계 복원을 위해 매년 정부 총지출 대비 5% 수준으로 R&D 예산 확대 노력, R&D 예산 심의의 전문성·전략성 제고",,"* 예산 배분‧조정 기한을 충분히 확보하고, R&D 예산 심의 범위 확대",medium,review_required,attached_review_support
PMD-DOC-POL-005-0155,DOC-POL-005,section5,CLS-SEED-DOC-POL-005-00331,PAR-DOC-POL-005-00331,bullet,중기 포트폴리오,ㅇ (중기 포트폴리오) 일관성과 장기적 전략성을 갖고 R&D투자가 이루어지도록 유형별(기초연구/전략기술 등) 중기 투자 포트폴리오 설계,policy_action,,,,,,,CLS-SEED-DOC-POL-005-00331,PAR-DOC-POL-005-00331,1,CLS-SEED-DOC-POL-005-00333,1,ㅇ (중기 포트폴리오) 일관성과 장기적 전략성을 갖고 R&D투자가 이루어지도록 유형별(기초연구/전략기술 등) 중기 투자 포트폴리오 설계,,* 중장기 투자전략 등의 수립 시 민간 전문성에 기반(기술분야별 전문위를 포함한 다양한 전문가 의견 수렴)하여 기술분야별 특성을 반영한 포트폴리오 설계 및 검토,medium,review_required,attached_review_support
PMD-DOC-POL-005-0156,DOC-POL-005,section5,CLS-SEED-DOC-POL-005-00336,PAR-DOC-POL-005-00336,bullet,과학/기술,ㅇ (과학/기술) 첨단 과학 연구와 원천기술 개발을 구분하고 개별 특성에 맞는 맞춤형 투자-심의,policy_action,,technology,technology,,,,CLS-SEED-DOC-POL-005-00336,PAR-DOC-POL-005-00336,1,,0,ㅇ (과학/기술) 첨단 과학 연구와 원천기술 개발을 구분하고 개별 특성에 맞는 맞춤형 투자-심의,,,medium,review_required,
PMD-DOC-POL-005-0157,DOC-POL-005,section5,CLS-SEED-DOC-POL-005-00337,PAR-DOC-POL-005-00337,bullet,지식의 경계를 확장하는 첨단 과학 연구를 위해 연구현장의 자율성‧유연성을 보장하는 프로그램형 사업 확대,- 지식의 경계를 확장하는 첨단 과학 연구를 위해 연구현장의 자율성‧유연성을 보장하는 프로그램형 사업 확대,policy_action,,,,,,,CLS-SEED-DOC-POL-005-00337,PAR-DOC-POL-005-00337,1,,0,- 지식의 경계를 확장하는 첨단 과학 연구를 위해 연구현장의 자율성‧유연성을 보장하는 프로그램형 사업 확대,,,medium,review_required,
PMD-DOC-POL-005-0158,DOC-POL-005,section5,CLS-SEED-DOC-POL-005-00338,PAR-DOC-POL-005-00338,bullet,경제적 파급력을 유발하는 원천기술 개발을 위해 체계적･중장기적 국가 R&D 투자의 청사진을 제시하여 임...,- 경제적 파급력을 유발하는 원천기술 개발을 위해 체계적･중장기적 국가 R&D 투자의 청사진을 제시하여 임무 중심으로 전략적 투자,policy_action,,technology,technology,,,,CLS-SEED-DOC-POL-005-00338,PAR-DOC-POL-005-00338,1,CLS-SEED-DOC-POL-005-00339,1,- 경제적 파급력을 유발하는 원천기술 개발을 위해 체계적･중장기적 국가 R&D 투자의 청사진을 제시하여 임무 중심으로 전략적 투자,,"※ 가시적 성과창출이 필요한 국가전략기술의 경우, 과학기술 및 환경변화, 국가임무에 맞게 체계를 고도화('25년말)하여 전략성 강화 (「국가전략기술육성법」)",medium,review_required,attached_review_support
PMD-DOC-POL-005-0159,DOC-POL-005,section5,CLS-SEED-DOC-POL-005-00340,PAR-DOC-POL-005-00340,bullet,국가적으로 긴급대응이 필요한 R&D의 신속-적시 추진을 위한 지원방안 마련 검토,- 국가적으로 긴급대응이 필요한 R&D의 신속-적시 추진을 위한 지원방안 마련 검토,policy_action,,talent,talent,,,,CLS-SEED-DOC-POL-005-00340,PAR-DOC-POL-005-00340,1,CLS-SEED-DOC-POL-005-00342,1,- 국가적으로 긴급대응이 필요한 R&D의 신속-적시 추진을 위한 지원방안 마련 검토,,"※ (예) 전략기술(=속도와 유연성), 기초-원천연구(자율적 연구와 안정적 장기투자), 연구성과확산(기술-수요매칭, 사업간 연계) 등 사업별 특징과 자율성-다양성을 고려",medium,review_required,attached_review_support
PMD-DOC-POL-005-0160,DOC-POL-005,section5,CLS-SEED-DOC-POL-005-00343,PAR-DOC-POL-005-00343,bullet,연구지속성이 요구되는 기초연구사업 및 범부처 임무형R&D사업*에 대해서는 다년도 예산 운영 계획 아래,"- 연구지속성이 요구되는 기초연구사업 및 범부처 임무형R&D사업*에 대해서는 다년도 예산 운영 계획 아래, 계속사업비 인정 확대 추진",policy_action,,infrastructure_policy,infrastructure_policy,,,,CLS-SEED-DOC-POL-005-00343,PAR-DOC-POL-005-00343,1,CLS-SEED-DOC-POL-005-00344,1,"- 연구지속성이 요구되는 기초연구사업 및 범부처 임무형R&D사업*에 대해서는 다년도 예산 운영 계획 아래, 계속사업비 인정 확대 추진",,* 범부처 통합 예산 투자 적용,medium,review_required,attached_review_support
PMD-DOC-POL-005-0161,DOC-POL-005,section5,CLS-SEED-DOC-POL-005-00345,PAR-DOC-POL-005-00345,bullet,수요자･민간의 예산심의 참여 확대,□ 수요자･민간의 예산심의 참여 확대,policy_action,,infrastructure_policy,infrastructure_policy,,,,CLS-SEED-DOC-POL-005-00345,PAR-DOC-POL-005-00345,1,,0,□ 수요자･민간의 예산심의 참여 확대,,,medium,review_required,
PMD-DOC-POL-005-0162,DOC-POL-005,section5,CLS-SEED-DOC-POL-005-00346,PAR-DOC-POL-005-00346,bullet,전문성 강화,ㅇ (전문성 강화) R&D 예산심의가 연구현장과 괴리되어 일반 재정사업 심의와 동질화되지 않도록 현장 전문성 기반 심의체계 고도화,policy_action,,,,,,,CLS-SEED-DOC-POL-005-00346,PAR-DOC-POL-005-00346,1,CLS-SEED-DOC-POL-005-00347,1,ㅇ (전문성 강화) R&D 예산심의가 연구현장과 괴리되어 일반 재정사업 심의와 동질화되지 않도록 현장 전문성 기반 심의체계 고도화,,"※ 전문위 세분화 및 역할 확대, 민-관 인사교류 활용, 정책 분야 위원 확충, 집행단계 모니터링, AI 활용 사업(과제)간 유사중복 검토 등",medium,review_required,attached_review_support
PMD-DOC-POL-005-0163,DOC-POL-005,section5,CLS-SEED-DOC-POL-005-00348,PAR-DOC-POL-005-00348,bullet,개방성 강화,"ㅇ (개방성 강화) 충분한 소통을 통한 심의를 위해 정부 주도의 일방향 심의를 사업부처, 외부 전문가도 참여하는 개방형 심의로 전환",policy_action,,infrastructure_policy,infrastructure_policy,,,,CLS-SEED-DOC-POL-005-00348,PAR-DOC-POL-005-00348,1,CLS-SEED-DOC-POL-005-00349 | CLS-SEED-DOC-POL-005-00350,2,"ㅇ (개방성 강화) 충분한 소통을 통한 심의를 위해 정부 주도의 일방향 심의를 사업부처, 외부 전문가도 참여하는 개방형 심의로 전환",,"※ 주요사업, 쟁점사업 대상으로 충분한 설명과 논의를 통한 예산 반영 || ※ R&D 예산 구조 및 투자 포트폴리오의 접근성 확대",medium,review_required,attached_review_support
PMD-DOC-POL-005-0164,DOC-POL-005,section5,CLS-SEED-DOC-POL-005-00352,PAR-DOC-POL-005-00352,bullet,기본방향,ㅇ (기본방향) 1천억원 이상의 대규모 R&D는 유형* 및 특성에 따른 맞춤형 사전 점검 및 사업관리체계 도입,policy_action,,technology,technology,,,,CLS-SEED-DOC-POL-005-00352,PAR-DOC-POL-005-00352,1,CLS-SEED-DOC-POL-005-00353,1,ㅇ (기본방향) 1천억원 이상의 대규모 R&D는 유형* 및 특성에 따른 맞춤형 사전 점검 및 사업관리체계 도입,,"* (연구형) 기초·원천연구, 국제연구 등 구축형 외 모든 R&D → 신속·유연성 필요 (구축형) 연구시설⸱장비, 연구단지 등을 개발⸱구축하는 사업 → 체계적 관리 필요",medium,review_required,attached_review_support
PMD-DOC-POL-005-0165,DOC-POL-005,section5,CLS-SEED-DOC-POL-005-00354,PAR-DOC-POL-005-00354,bullet,연구형,ㅇ (연구형) 당락을 결정하는 평가(예타) 대신 기획보완 중심의 사전점검(예산요구 전 11월~3월)을 실시하여 사업 추진 2년 이상 단축,policy_action,,infrastructure_policy,infrastructure_policy,,,,CLS-SEED-DOC-POL-005-00354,PAR-DOC-POL-005-00354,1,,0,ㅇ (연구형) 당락을 결정하는 평가(예타) 대신 기획보완 중심의 사전점검(예산요구 전 11월~3월)을 실시하여 사업 추진 2년 이상 단축,,,medium,review_required,
PMD-DOC-POL-005-0166,DOC-POL-005,section5,CLS-SEED-DOC-POL-005-00355,PAR-DOC-POL-005-00355,bullet,사전기획점검,- (사전기획점검) 예산심의 체계(분야별 전문위)에 따라 사업군 단위로 점검*하고 예산심의와 연계성 강화**(R&D 신속성⸱투자효율성 제고),policy_action,,infrastructure_policy,infrastructure_policy,,,,CLS-SEED-DOC-POL-005-00355,PAR-DOC-POL-005-00355,1,CLS-SEED-DOC-POL-005-00356 | CLS-SEED-DOC-POL-005-00357,2,- (사전기획점검) 예산심의 체계(분야별 전문위)에 따라 사업군 단위로 점검*하고 예산심의와 연계성 강화**(R&D 신속성⸱투자효율성 제고),,* (기존 예타 제도) 개별사업 당락결정 → (개선) 사업군별 검토로 사업 간 조정·통합 등 효율화 || ** 사전점검(미비점 도출) → (기획보완) → 예산심의(점검결과를 토대로 예산반영 결정),medium,review_required,attached_review_support
PMD-DOC-POL-005-0167,DOC-POL-005,section5,CLS-SEED-DOC-POL-005-00360,PAR-DOC-POL-005-00360,bullet,구축형,ㅇ (구축형) 현장의 우선순위에 의해 소요를 결정하는 제도적 절차를 마련하고 사업의 체계적 관리 및 단계별 점검 강화,policy_action,,infrastructure_policy,infrastructure_policy,,,,CLS-SEED-DOC-POL-005-00360,PAR-DOC-POL-005-00360,1,,0,ㅇ (구축형) 현장의 우선순위에 의해 소요를 결정하는 제도적 절차를 마련하고 사업의 체계적 관리 및 단계별 점검 강화,,,medium,review_required,
PMD-DOC-POL-005-0168,DOC-POL-005,section5,CLS-SEED-DOC-POL-005-00361,PAR-DOC-POL-005-00361,bullet,기획단계,- (기획단계) ‘과학적 큰 질문’을 근간으로 하는 대형 연구인프라 구축을 위해 민간 중심의 협의체*를 운영하여 소요결정,policy_action,,infrastructure_policy,infrastructure_policy,,,,CLS-SEED-DOC-POL-005-00361,PAR-DOC-POL-005-00361,1,CLS-SEED-DOC-POL-005-00362 | CLS-SEED-DOC-POL-005-00363,2,- (기획단계) ‘과학적 큰 질문’을 근간으로 하는 대형 연구인프라 구축을 위해 민간 중심의 협의체*를 운영하여 소요결정,,* 美 물리학계의 우선순위를 결정하는 민간 협의절차(SNOWMASS)를 국내 상황에 맞게 도입 || ※ (민간) 순수 과학적 우선순위 도출 → (정부) 제반 여건을 고려하여 구축계획 수립,medium,review_required,attached_review_support
PMD-DOC-POL-005-0169,DOC-POL-005,section5,CLS-SEED-DOC-POL-005-00364,PAR-DOC-POL-005-00364,bullet,단계관리,- (단계관리) 사업착수→기본/실시설계→시공의 전 단계를 단계적 프로젝트관리 방식(Phase Review)을 도입*하여 체계적으로 관리,policy_action,,,,,,,CLS-SEED-DOC-POL-005-00364,PAR-DOC-POL-005-00364,1,CLS-SEED-DOC-POL-005-00365 | CLS-SEED-DOC-POL-005-00366,2,- (단계관리) 사업착수→기본/실시설계→시공의 전 단계를 단계적 프로젝트관리 방식(Phase Review)을 도입*하여 체계적으로 관리,,* 사업기획 → 개념설계 → 기본/실시설계 → 시공 전단계 심사 실시 || ※ 사업별 기술검토단을 구성하여 기획~완공 전주기를 일관되게 점검,medium,review_required,attached_review_support
PMD-DOC-POL-005-0170,DOC-POL-005,section5,CLS-SEED-DOC-POL-005-00368,PAR-DOC-POL-005-00368,bullet,현장 수요 반영,"ㅇ (현장 수요 반영) 산업계-연구계 등 수요자 중심의 新 개방형 상시기획체계*로 전환, 현장 수요와 기술변화에 유연한 대응 체계 구축",policy_action,,,,,,,CLS-SEED-DOC-POL-005-00368,PAR-DOC-POL-005-00368,1,CLS-SEED-DOC-POL-005-00369,1,"ㅇ (현장 수요 반영) 산업계-연구계 등 수요자 중심의 新 개방형 상시기획체계*로 전환, 현장 수요와 기술변화에 유연한 대응 체계 구축",,* (현재) 부처-전문기관 중심 → (개선) 민간-과학기술단체 등 활용 연구수요-트렌드 반영,medium,review_required,attached_review_support
PMD-DOC-POL-005-0171,DOC-POL-005,section5,CLS-SEED-DOC-POL-005-00370,PAR-DOC-POL-005-00370,bullet,연구계,- (연구계) 학회와의 소통을 확대하여 다수의 연구자 참여 기반 신흥 원천기술 발굴-기획 전문성을 강화하고 기술변화에 신속 대응,policy_action,,infrastructure_policy,infrastructure_policy,,,,CLS-SEED-DOC-POL-005-00370,PAR-DOC-POL-005-00370,1,CLS-SEED-DOC-POL-005-00371 | CLS-SEED-DOC-POL-005-00372,2,- (연구계) 학회와의 소통을 확대하여 다수의 연구자 참여 기반 신흥 원천기술 발굴-기획 전문성을 강화하고 기술변화에 신속 대응,,"※ 학회연합회를 통한 종합간담회 개최(연 2회), 과학기술 정책방향 소개 및 의견 수렴 || ※ 과총 소속 학회 682개 대상 정기 기술수요 조사 실시 → 과총(학회)-전문기관-부처 참여 기획협의체 운영(신규 사업-과제 기획) → 예산 반영 및 종합간담회 보고",medium,review_required,attached_review_support
PMD-DOC-POL-005-0172,DOC-POL-005,section5,CLS-SEED-DOC-POL-005-00373,PAR-DOC-POL-005-00373,bullet,산업계,- (산업계) 분야별 민-관 R&D 협의체* 운영을 통해 기술수요 발굴 단계부터 기획 및 컨소시엄 구성까지 기업이 주도하여 추진,policy_action,,infrastructure_policy,infrastructure_policy,STR-002,TD-003,,CLS-SEED-DOC-POL-005-00373,PAR-DOC-POL-005-00373,1,CLS-SEED-DOC-POL-005-00374,1,- (산업계) 분야별 민-관 R&D 협의체* 운영을 통해 기술수요 발굴 단계부터 기획 및 컨소시엄 구성까지 기업이 주도하여 추진,,"* 첨단바이오, 반도체, 디스플레이, 이차전지 등 산업 관련성이 높은 분야 중심으로 운영",medium,review_required,attached_review_support
