merge_candidate_id,document_id,page_no,primary_seed_id,primary_source_object_id,primary_block_type,item_label_draft,item_statement_draft,candidate_role_draft,candidate_role_notes,bucket_resource_type_guess,resource_type_candidates,primary_strategy_candidates,tech_domain_candidates,tech_subdomain_candidates,member_seed_ids,member_source_object_ids,member_count,supporting_review_seed_ids,supporting_review_count,primary_text,continuation_texts,supporting_review_texts,merge_confidence,merge_status,merge_notes
PMD-DOC-POL-005-0106,DOC-POL-005,section5,CLS-SEED-DOC-POL-005-00231,PAR-DOC-POL-005-00231,bullet,기준에 맞춰 개선된 기존 시설 및 공동활용 장비의 집적 인증 시 인센티브*를 부여하여 우수 공동활용 시...,- 기준에 맞춰 개선된 기존 시설 및 공동활용 장비의 집적 인증 시 인센티브*를 부여하여 우수 공동활용 시설의 확산 도모,policy_action,,technology,technology,,,,CLS-SEED-DOC-POL-005-00231,PAR-DOC-POL-005-00231,1,CLS-SEED-DOC-POL-005-00232 | CLS-SEED-DOC-POL-005-00233,2,- 기준에 맞춰 개선된 기존 시설 및 공동활용 장비의 집적 인증 시 인센티브*를 부여하여 우수 공동활용 시설의 확산 도모,,"* 이용료 재투자 범위 확대, 인건비-운영비-공동활용 장비 구축 지원 등 || ※ 약 500여개 등록 시설 중 80% 이상을 표준 모델 수준으로 상향평준화 추진(~'29)",medium,review_required,attached_review_support
PMD-DOC-POL-005-0107,DOC-POL-005,section5,CLS-SEED-DOC-POL-005-00235,PAR-DOC-POL-005-00235,bullet,공동 구축-활용 허용,"ㅇ (공동 구축-활용 허용) GPU, 고성능 서버 등 고가 연구시설-장비를 여러 과제에서 공동 구축-활용할 수 있도록 명확한 근거 규정* 마련",policy_action,,technology,technology,,,,CLS-SEED-DOC-POL-005-00235,PAR-DOC-POL-005-00235,1,CLS-SEED-DOC-POL-005-00236 | CLS-SEED-DOC-POL-005-00237,2,"ㅇ (공동 구축-활용 허용) GPU, 고성능 서버 등 고가 연구시설-장비를 여러 과제에서 공동 구축-활용할 수 있도록 명확한 근거 규정* 마련",,※ (현행) 규정 근거가 모호하여 연구시설-장비비는 과제별로 구축-활용 → (개선) 과제별 비용 분담을 통해 기관 단위 통합 구매 및 관리-활용 허용 || ※ 공동 구축-활용 시 사용료를 직접비에서 사용할 수 있도록 허용,medium,review_required,attached_review_support
PMD-DOC-POL-005-0108,DOC-POL-005,section5,CLS-SEED-DOC-POL-005-00238,PAR-DOC-POL-005-00238,bullet,공동활용 거점,"ㅇ (공동활용 거점) 우수 시설에 대한 집중 투자를 통해 거점을 조성하고, 거점-시설 간 협력을 통한 연구장비 공동활용 활성화",policy_action,,technology,technology,,,,CLS-SEED-DOC-POL-005-00238,PAR-DOC-POL-005-00238,1,,0,"ㅇ (공동활용 거점) 우수 시설에 대한 집중 투자를 통해 거점을 조성하고, 거점-시설 간 협력을 통한 연구장비 공동활용 활성화",,,medium,review_required,
PMD-DOC-POL-005-0109,DOC-POL-005,section5,CLS-SEED-DOC-POL-005-00240,PAR-DOC-POL-005-00240,bullet,나눔 장비 등록기관 대상 인센티브를 상향*하는 등 양질의 장비 등록을 장려하고 유휴-저활용 장비의 활용 제고,- 나눔 장비 등록기관 대상 인센티브를 상향*하는 등 양질의 장비 등록을 장려하고 유휴-저활용 장비의 활용 제고,policy_action,,technology,technology,,,,CLS-SEED-DOC-POL-005-00240,PAR-DOC-POL-005-00240,1,CLS-SEED-DOC-POL-005-00241,1,- 나눔 장비 등록기관 대상 인센티브를 상향*하는 등 양질의 장비 등록을 장려하고 유휴-저활용 장비의 활용 제고,,* 장비 유지-보수비로 환급이 가능한 마일리지 지급액 상향(등록 장비 1점당 150만원 → 300만원 이상) 및 사용 범위 확대 등 추진(`25~),medium,review_required,attached_review_support
PMD-DOC-POL-005-0110,DOC-POL-005,section5,CLS-SEED-DOC-POL-005-00242,PAR-DOC-POL-005-00242,bullet,AI기반 연구장비 공동활용,ㅇ (AI기반 연구장비 공동활용) 누구나 AI 기반으로 필요한 연구장비를 손쉽게 검색-활용할 수 있는 공동활용 플랫폼(ZEUS 3.0) 구축(~'29),policy_action,,technology,technology,,,,CLS-SEED-DOC-POL-005-00242,PAR-DOC-POL-005-00242,1,CLS-SEED-DOC-POL-005-00243,1,ㅇ (AI기반 연구장비 공동활용) 누구나 AI 기반으로 필요한 연구장비를 손쉽게 검색-활용할 수 있는 공동활용 플랫폼(ZEUS 3.0) 구축(~'29),,※ 시스템 개발 및 테스트(`25~`28) → 현장맞춤형 데이터 갱신(`27) → 운영 개시(`29~),medium,review_required,attached_review_support
PMD-DOC-POL-005-0111,DOC-POL-005,section5,CLS-SEED-DOC-POL-005-00246,PAR-DOC-POL-005-00246,bullet,심의기준 현실화,ㅇ (심의기준 현실화) 연구자율성을 높이고 필요한 연구장비를 신속-적시 도입할 수 있도록 연구장비 도입 시 심의기준 상향 개편,policy_action,,technology,technology,,,,CLS-SEED-DOC-POL-005-00246,PAR-DOC-POL-005-00246,1,CLS-SEED-DOC-POL-005-00247,1,ㅇ (심의기준 현실화) 연구자율성을 높이고 필요한 연구장비를 신속-적시 도입할 수 있도록 연구장비 도입 시 심의기준 상향 개편,,※ ’07년 이후 유지 중인 연구장비 심의기준금액(3천만원/1억원)의 현행화에 대한 현장 요구 지속,medium,review_required,attached_review_support
PMD-DOC-POL-005-0112,DOC-POL-005,section5,CLS-SEED-DOC-POL-005-00248,PAR-DOC-POL-005-00248,bullet,국가연구시설장비심의위원회 심의기준을 1억원에서 3억원으로,"- 국가연구시설장비심의위원회 심의기준을 1억원에서 3억원으로, 연구기관별 자체심의(또는 과제평가단) 기준은 3천만원에서 1억원으로 상향",policy_action,,technology,technology,,,,CLS-SEED-DOC-POL-005-00248,PAR-DOC-POL-005-00248,1,,0,"- 국가연구시설장비심의위원회 심의기준을 1억원에서 3억원으로, 연구기관별 자체심의(또는 과제평가단) 기준은 3천만원에서 1억원으로 상향",,,medium,review_required,
PMD-DOC-POL-005-0113,DOC-POL-005,section5,CLS-SEED-DOC-POL-005-00250,PAR-DOC-POL-005-00250,bullet,신속-적시 심의,"ㅇ (신속-적시 심의) 상시심의(매년 20회)를 활용하여 필요 장비의 적시 심의를 지원하고, 수요 증가가 예상되는 GPU 등은 신속심의로 진행하여 심사기간 단축",policy_action,detected_need_phrase_but_action_overrides,technology,technology,,,,CLS-SEED-DOC-POL-005-00250,PAR-DOC-POL-005-00250,1,,0,"ㅇ (신속-적시 심의) 상시심의(매년 20회)를 활용하여 필요 장비의 적시 심의를 지원하고, 수요 증가가 예상되는 GPU 등은 신속심의로 진행하여 심사기간 단축",,,medium,review_required,
PMD-DOC-POL-005-0114,DOC-POL-005,section5,CLS-SEED-DOC-POL-005-00251,PAR-DOC-POL-005-00251,bullet,사후 점검,"ㅇ (사후 점검) 기관 내 시설-장비의 활용상태를 주기적으로 점검(3년)하고, 결과에 따라 인센티브 및 페널티*를 부여하여 활용도 제고",policy_action,,technology,technology | infrastructure_policy,,,,CLS-SEED-DOC-POL-005-00251,PAR-DOC-POL-005-00251,1,CLS-SEED-DOC-POL-005-00252,1,"ㅇ (사후 점검) 기관 내 시설-장비의 활용상태를 주기적으로 점검(3년)하고, 결과에 따라 인센티브 및 페널티*를 부여하여 활용도 제고",,"* 자체평가 심의기준 완화 차등 적용, 경상비 증가율 차등 적용, 연구지원체계평가 및 기관평가 반영, 자체심의 기준금액 조정 등",medium,review_required,attached_review_support
PMD-DOC-POL-005-0115,DOC-POL-005,section5,CLS-SEED-DOC-POL-005-00253,PAR-DOC-POL-005-00253,bullet,과제 수주 경쟁에서 벗어나 안정적 지원 아래 본연의 연구에 몰입,□ 과제 수주 경쟁에서 벗어나 안정적 지원 아래 본연의 연구에 몰입,policy_action,,,,,,,CLS-SEED-DOC-POL-005-00253,PAR-DOC-POL-005-00253,1,,0,□ 과제 수주 경쟁에서 벗어나 안정적 지원 아래 본연의 연구에 몰입,,,medium,review_required,
PMD-DOC-POL-005-0116,DOC-POL-005,section5,CLS-SEED-DOC-POL-005-00254,PAR-DOC-POL-005-00254,bullet,PBS 단계적 폐지,"ㅇ (PBS 단계적 폐지) 임무 중심으로 시스템 전환을 위해 향후 5년간 다수-소액 수탁과제를 매년 종료 규모만큼 기관출연금으로 전환하고, 출연금 구조를 체계화",policy_action,,,,,,,CLS-SEED-DOC-POL-005-00254,PAR-DOC-POL-005-00254,1,,0,"ㅇ (PBS 단계적 폐지) 임무 중심으로 시스템 전환을 위해 향후 5년간 다수-소액 수탁과제를 매년 종료 규모만큼 기관출연금으로 전환하고, 출연금 구조를 체계화",,,medium,review_required,
PMD-DOC-POL-005-0117,DOC-POL-005,section5,CLS-SEED-DOC-POL-005-00255,PAR-DOC-POL-005-00255,bullet,기관 자율적으로 운영하는 ‘기본 연구사업’과 수요연계형으로 운영되는 ‘전략연구사업’으로 체계화,"- 기관 자율적으로 운영하는 ‘기본 연구사업’과 수요연계형으로 운영되는 ‘전략연구사업’으로 체계화, 기본 연구사업은 안정적으로 규모 유지",policy_action,,,,,,,CLS-SEED-DOC-POL-005-00255,PAR-DOC-POL-005-00255,1,,0,"- 기관 자율적으로 운영하는 ‘기본 연구사업’과 수요연계형으로 운영되는 ‘전략연구사업’으로 체계화, 기본 연구사업은 안정적으로 규모 유지",,,medium,review_required,
PMD-DOC-POL-005-0118,DOC-POL-005,section5,CLS-SEED-DOC-POL-005-00256,PAR-DOC-POL-005-00256,bullet,정부 등의 수요를 발굴･구체화하고 수행대상 출연연을 결정하는 범정부적 임무부여체계(범부처 협의회 등) 마련,- 정부 등의 수요를 발굴･구체화하고 수행대상 출연연을 결정하는 범정부적 임무부여체계(범부처 협의회 등) 마련,policy_action,,,,,,,CLS-SEED-DOC-POL-005-00256,PAR-DOC-POL-005-00256,1,,0,- 정부 등의 수요를 발굴･구체화하고 수행대상 출연연을 결정하는 범정부적 임무부여체계(범부처 협의회 등) 마련,,,medium,review_required,
PMD-DOC-POL-005-0119,DOC-POL-005,section5,CLS-SEED-DOC-POL-005-00257,PAR-DOC-POL-005-00257,bullet,우수 연구자 확보를 위한 처우개선-보상확대 및 채용제도 개선,□ 우수 연구자 확보를 위한 처우개선-보상확대 및 채용제도 개선,policy_action,,talent,talent,,,,CLS-SEED-DOC-POL-005-00257,PAR-DOC-POL-005-00257,1,,0,□ 우수 연구자 확보를 위한 처우개선-보상확대 및 채용제도 개선,,,medium,review_required,
PMD-DOC-POL-005-0120,DOC-POL-005,section5,CLS-SEED-DOC-POL-005-00258,PAR-DOC-POL-005-00258,bullet,보수체계 혁신,ㅇ (보수체계 혁신) 연구를 잘하는 연구자가 더 많은 보상을 받고 신진 연구자들이 첫 일터로 출연연을 선택할 수 있도록 보수체계 혁신,policy_action,,talent,talent,,,,CLS-SEED-DOC-POL-005-00258,PAR-DOC-POL-005-00258,1,,0,ㅇ (보수체계 혁신) 연구를 잘하는 연구자가 더 많은 보상을 받고 신진 연구자들이 첫 일터로 출연연을 선택할 수 있도록 보수체계 혁신,,,medium,review_required,
PMD-DOC-POL-005-0121,DOC-POL-005,section5,CLS-SEED-DOC-POL-005-00259,PAR-DOC-POL-005-00259,bullet,기관평가를 계획 대비 달성도 중심에서 대표성과 중심 평가로 전환 ('25년 시범평가 → '26년 연구회...,- 기관평가를 계획 대비 달성도 중심에서 대표성과 중심 평가로 전환 ('25년 시범평가 → '26년 연구회 전 기관 대상 도입),policy_action,,,,,,,CLS-SEED-DOC-POL-005-00259,PAR-DOC-POL-005-00259,1,,0,- 기관평가를 계획 대비 달성도 중심에서 대표성과 중심 평가로 전환 ('25년 시범평가 → '26년 연구회 전 기관 대상 도입),,,medium,review_required,
PMD-DOC-POL-005-0122,DOC-POL-005,section5,CLS-SEED-DOC-POL-005-00260,PAR-DOC-POL-005-00260,bullet,기관평가 결과와 연동한 전직원 대상 통합평가 성과급 및 우수 연구자 상여급 신설 ('26년),- 기관평가 결과와 연동한 전직원 대상 통합평가 성과급 및 우수 연구자 상여급 신설 ('26년),policy_action,,talent,talent,,,,CLS-SEED-DOC-POL-005-00260,PAR-DOC-POL-005-00260,1,,0,- 기관평가 결과와 연동한 전직원 대상 통합평가 성과급 및 우수 연구자 상여급 신설 ('26년),,,medium,review_required,
PMD-DOC-POL-005-0123,DOC-POL-005,section5,CLS-SEED-DOC-POL-005-00261,PAR-DOC-POL-005-00261,bullet,처우 수준을 개선하고 성과연동 보상체계* 공고화,- 처우 수준을 개선하고 성과연동 보상체계* 공고화,policy_action,,talent,talent,,,,CLS-SEED-DOC-POL-005-00261,PAR-DOC-POL-005-00261,1,CLS-SEED-DOC-POL-005-00262,1,- 처우 수준을 개선하고 성과연동 보상체계* 공고화,,* (안) 우수연구자 상여급 지급 등 성과달성에 따른 보상 확대,medium,review_required,attached_review_support
PMD-DOC-POL-005-0124,DOC-POL-005,section5,CLS-SEED-DOC-POL-005-00263,PAR-DOC-POL-005-00263,bullet,겸직 활성화,ㅇ (겸직 활성화) 우수 연구자가 대학-출연연-기업 등 여러 기관의 역량을 모두 활용하여 우수한 성과를 창출할 수 있도록 겸직 활성화,policy_action,,talent,talent,,,,CLS-SEED-DOC-POL-005-00263,PAR-DOC-POL-005-00263,1,CLS-SEED-DOC-POL-005-00264,1,ㅇ (겸직 활성화) 우수 연구자가 대학-출연연-기업 등 여러 기관의 역량을 모두 활용하여 우수한 성과를 창출할 수 있도록 겸직 활성화,,※ 우수연구자의 겸직 허용 등 처우개선 사항에 대해 기관평가 시 인센티브 부여 등 검토,medium,review_required,attached_review_support
PMD-DOC-POL-005-0125,DOC-POL-005,section5,CLS-SEED-DOC-POL-005-00265,PAR-DOC-POL-005-00265,bullet,블라인드 채용,ㅇ (블라인드 채용) 출연연 블라인드 채용제도가 합리적-탄력적으로 운영되도록 채용 시 심사위원에게 채용서류 원문을 제공 (채용 관련 세부지침 개정),policy_action,,talent,talent,,,,CLS-SEED-DOC-POL-005-00265,PAR-DOC-POL-005-00265,1,CLS-SEED-DOC-POL-005-00266 | CLS-SEED-DOC-POL-005-00267 | CLS-SEED-DOC-POL-005-00268,3,ㅇ (블라인드 채용) 출연연 블라인드 채용제도가 합리적-탄력적으로 운영되도록 채용 시 심사위원에게 채용서류 원문을 제공 (채용 관련 세부지침 개정),,"※ (제도 현황) 관계 법령에 근거하여 연령, 성별, 종교 등 직무와 무관한 인적사항은 수집 금지하고 있으며, 블라인드 채용 폐지 발표(’22년) 이후 과학기술분야 정부출연연구기관은 학력, 논문, 추천서 등의 정보는 수집 가능 || ※ (현장 운영현황) 인사담당자는 감사 부담 등을 이유로 수집 금지 정보 외에도 이름 등 개인이 특정되는 항목은 심사위원에게 공란처리하여 제공 → 심사위원들은 블라인드 채용이 유지된다고 인식 || ※ (개선) 심사위원에게 채용서류 원문(이름 포함)을 제공하되, 지원자가 고의적으로 수집금지 정보 노출 시 심사위원 판단 하에 제한적으로 불이익 조치 실시",medium,review_required,attached_review_support
PMD-DOC-POL-005-0126,DOC-POL-005,section5,CLS-SEED-DOC-POL-005-00269,PAR-DOC-POL-005-00269,bullet,특별채용 확대,ㅇ (특별채용 확대) 우수인재를 적시에 확보하고 적재적소에 활용할 수 있도록 Post-Doc 등에 대한 특별채용 확대,policy_action,,talent,talent,,,,CLS-SEED-DOC-POL-005-00269,PAR-DOC-POL-005-00269,1,,0,ㅇ (특별채용 확대) 우수인재를 적시에 확보하고 적재적소에 활용할 수 있도록 Post-Doc 등에 대한 특별채용 확대,,,medium,review_required,
PMD-DOC-POL-005-0127,DOC-POL-005,section5,CLS-SEED-DOC-POL-005-00270,PAR-DOC-POL-005-00270,bullet,국가특임연구원*에 대해서만 허용되던 특별채용을 Post-Doc 등으로 확대할 수 있도록 출연(연) 운영...,- 국가특임연구원*에 대해서만 허용되던 특별채용을 Post-Doc 등으로 확대할 수 있도록 출연(연) 운영 관련 규정(과기부 훈령 등) 개정,policy_action,,talent,talent,,,,CLS-SEED-DOC-POL-005-00270,PAR-DOC-POL-005-00270,1,CLS-SEED-DOC-POL-005-00271 | CLS-SEED-DOC-POL-005-00274,2,- 국가특임연구원*에 대해서만 허용되던 특별채용을 Post-Doc 등으로 확대할 수 있도록 출연(연) 운영 관련 규정(과기부 훈령 등) 개정,,* 글로벌 경쟁력을 갖춘 탁월한 국내외 석학은 3년 이내 임기제(연장가능)로 특별채용 가능('25년~) || * 현재 기관운영평가-연구사업평가로 이원화된 기관평가를 통합하여 실효성 제고,medium,review_required,attached_review_support
PMD-DOC-POL-005-0128,DOC-POL-005,section5,CLS-SEED-DOC-POL-005-00275,PAR-DOC-POL-005-00275,bullet,계획에 대한 별도 평가는 폐지하고,"- 계획에 대한 별도 평가는 폐지하고, 각 기관 중장기 지향점-성과 등에 대해 외부에 공개하여 관계 전문가-일반 국민의 개방형 검증 유도",policy_action,,talent,talent,,,,CLS-SEED-DOC-POL-005-00275,PAR-DOC-POL-005-00275,1,CLS-SEED-DOC-POL-005-00276,1,"- 계획에 대한 별도 평가는 폐지하고, 각 기관 중장기 지향점-성과 등에 대해 외부에 공개하여 관계 전문가-일반 국민의 개방형 검증 유도",,"※ 학생·일반인 대상으로 한 교육·과학문화 활동, 산학협력 등 사회적 기여와 과학기술 저변 확대 노력·정도를 평가지표에 반영 추진",medium,review_required,attached_review_support
PMD-DOC-POL-005-0129,DOC-POL-005,section5,CLS-SEED-DOC-POL-005-00277,PAR-DOC-POL-005-00277,bullet,기존의 복잡-다수 평가지표를 간소화하고 기관 대표성과(3개 이내) 배점을 가장 높게 설정하여 국민체감형...,- 기존의 복잡-다수 평가지표를 간소화하고 기관 대표성과(3개 이내) 배점을 가장 높게 설정하여 국민체감형 성과 창출에 기관 역량 집중 독려,policy_action,,,,,,,CLS-SEED-DOC-POL-005-00277,PAR-DOC-POL-005-00277,1,,0,- 기존의 복잡-다수 평가지표를 간소화하고 기관 대표성과(3개 이내) 배점을 가장 높게 설정하여 국민체감형 성과 창출에 기관 역량 집중 독려,,,medium,review_required,
PMD-DOC-POL-005-0130,DOC-POL-005,section5,CLS-SEED-DOC-POL-005-00279,PAR-DOC-POL-005-00279,bullet,환류 강화,ㅇ (환류 강화) 평가 결과를 기본사업 예산 및 기관경상비 증감률 산정에 반영하여 평가 결과에 대한 실질적-긍정적 환류 강화,policy_action,,infrastructure_policy,infrastructure_policy,,,,CLS-SEED-DOC-POL-005-00279,PAR-DOC-POL-005-00279,1,CLS-SEED-DOC-POL-005-00280,1,ㅇ (환류 강화) 평가 결과를 기본사업 예산 및 기관경상비 증감률 산정에 반영하여 평가 결과에 대한 실질적-긍정적 환류 강화,,"※ 현행 평가체계에서, 평가 결과 미흡에 따른 부정적 환류는 분명하나 우수한 결과일 때의 인센티브는 거의 없는 상황으로, 평가결과-예산 환류의 긍정적 측면 부족",medium,review_required,attached_review_support
PMD-DOC-POL-005-0131,DOC-POL-005,section5,CLS-SEED-DOC-POL-005-00282,PAR-DOC-POL-005-00282,bullet,기반확보 지원,ㅇ (기반확보 지원) 개별 연구자-과제가 아닌 대학이 중심이 되어 자율적-안정적으로 연구 역량을 키울 수 있는 대학 단위 연구 지원,policy_action,,,,,,,CLS-SEED-DOC-POL-005-00282,PAR-DOC-POL-005-00282,1,,0,ㅇ (기반확보 지원) 개별 연구자-과제가 아닌 대학이 중심이 되어 자율적-안정적으로 연구 역량을 키울 수 있는 대학 단위 연구 지원,,,medium,review_required,
PMD-DOC-POL-005-0132,DOC-POL-005,section5,CLS-SEED-DOC-POL-005-00283,PAR-DOC-POL-005-00283,bullet,대학 단위에서 연구시설-장비를 구축하고 연구지원인력을 고용-활용하기 위해 필요한 비용을 블록펀딩 방식으...,- 대학 단위에서 연구시설-장비를 구축하고 연구지원인력을 고용-활용하기 위해 필요한 비용을 블록펀딩 방식으로 지원,policy_action,,talent,talent,,,,CLS-SEED-DOC-POL-005-00283,PAR-DOC-POL-005-00283,1,CLS-SEED-DOC-POL-005-00284,1,- 대학 단위에서 연구시설-장비를 구축하고 연구지원인력을 고용-활용하기 위해 필요한 비용을 블록펀딩 방식으로 지원,,"※ 특히 연구지원인력(테크니션 등 시설장비전문인력, 연구행정지원인력 등)에게 법적 지위를 부여하고, 고용 안정성을 높여 대학 연구의 중심축이 되도록 지원",medium,review_required,attached_review_support
PMD-DOC-POL-005-0133,DOC-POL-005,section5,CLS-SEED-DOC-POL-005-00285,PAR-DOC-POL-005-00285,bullet,차세대연구자 육성,"ㅇ (차세대연구자 육성) 대학생 및 청년 연구자의 안정적‧포용적 성장을 위해 경제적 부담을 완화*하고, 연구와 경력개발 기회 대폭 확대**",policy_action,,,,,,,CLS-SEED-DOC-POL-005-00285,PAR-DOC-POL-005-00285,1,CLS-SEED-DOC-POL-005-00286 | CLS-SEED-DOC-POL-005-00287,2,"ㅇ (차세대연구자 육성) 대학생 및 청년 연구자의 안정적‧포용적 성장을 위해 경제적 부담을 완화*하고, 연구와 경력개발 기회 대폭 확대**",,"* 대학원 연구생활장려금 확대(지원대학 확대 및 최저지급액 기준 점진적 상향) 등 || ** 박사후연구원을 위한 4대 과기원 융합 연구 및 산·학·연 경력개발 지원 확대, 산학협력 브릿지사업 신설(‘26), 기본연구 및 우수 신진연구자 지원과제 확대 등",medium,review_required,attached_review_support
PMD-DOC-POL-005-0134,DOC-POL-005,section5,CLS-SEED-DOC-POL-005-00288,PAR-DOC-POL-005-00288,bullet,지역혁신 견인,ㅇ (지역혁신 견인) 지역 혁신의 주체로서 지역 거점 대학이 수도권에 준하는 연구경쟁력을 갖출 수 있도록 연구비 확대 및 석-박사 지원 강화,policy_action,,,,,,,CLS-SEED-DOC-POL-005-00288,PAR-DOC-POL-005-00288,1,,0,ㅇ (지역혁신 견인) 지역 혁신의 주체로서 지역 거점 대학이 수도권에 준하는 연구경쟁력을 갖출 수 있도록 연구비 확대 및 석-박사 지원 강화,,,medium,review_required,
PMD-DOC-POL-005-0135,DOC-POL-005,section5,CLS-SEED-DOC-POL-005-00289,PAR-DOC-POL-005-00289,bullet,우선적으로 연구 기반 환경이 열악한 지역*을 대상으로 과기원 수준의 연구비 및 석-박사 지원 확대** 검토,- 우선적으로 연구 기반 환경이 열악한 지역*을 대상으로 과기원 수준의 연구비 및 석-박사 지원 확대** 검토,policy_action,,technology,technology | infrastructure_policy,,,,CLS-SEED-DOC-POL-005-00289,PAR-DOC-POL-005-00289,1,CLS-SEED-DOC-POL-005-00290 | CLS-SEED-DOC-POL-005-00291 | CLS-SEED-DOC-POL-005-00292,3,- 우선적으로 연구 기반 환경이 열악한 지역*을 대상으로 과기원 수준의 연구비 및 석-박사 지원 확대** 검토,,"* 과기원이 없는 3특 지역, 특화 연구 필요성 등을 종합적으로 고려 || ** 과제 기반으로는 안정적인 인건비 확보가 어려운 지역 석-박사 학생들이 Stipend 외에도 장학금 지원을 추가로 받도록 확대-연계 || ※ 국가연구소(NRL 2.0), RISE 등 기존 지역대학 육성정책과 연계하여 효과성 제고 및 예산 효율성 증대",medium,review_required,attached_review_support
PMD-DOC-POL-005-0136,DOC-POL-005,section5,CLS-SEED-DOC-POL-005-00293,PAR-DOC-POL-005-00293,bullet,기초연구 생태계 고도화로 창의-자율 연구기반 강화,□ 기초연구 생태계 고도화로 창의-자율 연구기반 강화,policy_action,,technology,technology,,,,CLS-SEED-DOC-POL-005-00293,PAR-DOC-POL-005-00293,1,,0,□ 기초연구 생태계 고도화로 창의-자율 연구기반 강화,,,medium,review_required,
PMD-DOC-POL-005-0137,DOC-POL-005,section5,CLS-SEED-DOC-POL-005-00294,PAR-DOC-POL-005-00294,bullet,생태계 복원,"ㅇ (생태계 복원) 전임-비전임 교원의 기본연구 복원, 과제별 최소 연구기간 연장* 및 집단연구 최적화** 등을 통해 기초연구 생태계 복원 및 연구 몰입환경 조성",policy_action,,infrastructure_policy,infrastructure_policy,,,,CLS-SEED-DOC-POL-005-00294,PAR-DOC-POL-005-00294,1,CLS-SEED-DOC-POL-005-00295 | CLS-SEED-DOC-POL-005-00296,2,"ㅇ (생태계 복원) 전임-비전임 교원의 기본연구 복원, 과제별 최소 연구기간 연장* 및 집단연구 최적화** 등을 통해 기초연구 생태계 복원 및 연구 몰입환경 조성",,* (기본연구) 최대 5년 / (신진-씨앗연구) 1년→ 최대 3년 || ** 기초연구실/선도연구센터/G-LAMP/NRL2.0 등 규모-역할별 전략적 차등화 및 다학제 기반 융복합 연구 활성화,medium,review_required,attached_review_support
PMD-DOC-POL-005-0138,DOC-POL-005,section5,CLS-SEED-DOC-POL-005-00297,PAR-DOC-POL-005-00297,bullet,유연한 관리체계,"ㅇ (유연한 관리체계) 복잡한 사업 구조를 통합-단순화하고, 기초연구 관리체계를 유연하게 전환하여 연구자의 자율성 강화",policy_action,,talent,talent,,,,CLS-SEED-DOC-POL-005-00297,PAR-DOC-POL-005-00297,1,CLS-SEED-DOC-POL-005-00298,1,"ㅇ (유연한 관리체계) 복잡한 사업 구조를 통합-단순화하고, 기초연구 관리체계를 유연하게 전환하여 연구자의 자율성 강화",,"※ 연구 내용 및 특성에 맞는 연구비(규모)를 자율적으로 선택할 수 있도록 하고, 과제 신청현황에 따라 유형 간 과제 수를 조정할 수 있도록 유연성 부여",medium,review_required,attached_review_support
