paragraph_id,document_id,page_no,page_block_order,block_type,text,source_line_count,merged_block_count,normalization_actions,source_mode
PAR-DOC-BMK-002-00752,DOC-BMK-002,48,5,heading,"1. Programme evaluations shall be carried out in a timely manner to feed into the decision-making process of the Programme, the next framework programme and other initiatives relevant to R&I.",3,1,,bbox_text
PAR-DOC-BMK-002-00753,DOC-BMK-002,48,6,heading,"2. The interim evaluation of the Programme shall be carried out with the assistance of independent experts selected on the basis of a transparent process once there is sufficient information available about the implementation of the Programme, but no later than four years after the start of that implementation. It shall include a portfolio analysis and an assessment of the long-term impact of previous framework programmes and shall form the basis to adjust or re-orientate the Programme, as appropriate. It shall assess the Programme's effectiveness, efficiency, relevance, coherence, and Union added value.",7,1,,bbox_text
PAR-DOC-BMK-002-00754,DOC-BMK-002,48,7,heading,"3. At the end of the implementation of the Programme, but no later than four years after the end of the period specified in Article 1, a final evaluation of the Programme shall be completed by the Commission. It shall include an assessment of the long-term impact of previous framework programmes.",4,1,,bbox_text
PAR-DOC-BMK-002-00755,DOC-BMK-002,48,8,heading,"4. The Commission shall publish and communicate the conclusions of the evaluations accompanied by its observations and shall present them to the European Parliament, the Council, the European Economic and Social Committee and the Committee of the Regions.",4,1,,bbox_text
PAR-DOC-BMK-002-00756,DOC-BMK-002,48,9,paragraph,Article 53 Audits,2,2,merged_continuation,bbox_text
PAR-DOC-BMK-002-00757,DOC-BMK-002,48,10,heading,"1. The control system for the Programme shall ensure an appropriate balance between trust and control, taking into account administrative and other costs of controls at all levels, especially for beneficiaries. Audit rules shall be clear, consistent and coherent throughout the Programme.",4,1,,bbox_text
PAR-DOC-BMK-002-00758,DOC-BMK-002,48,11,heading,"2. The audit strategy for the Programme shall be based on the financial audit of a representative sample of expenditure across the Programme as a whole. The representative sample shall be complemented by a selection based on an assessment of the risks related to expenditure. Actions that receive joint funding from different Union programmes shall be audited only once, covering all programmes involved and their respective applicable rules.",5,1,,bbox_text
PAR-DOC-BMK-002-00759,DOC-BMK-002,48,12,heading,"3. In addition, the Commission or the relevant funding body may rely on system and processes audits at beneficiary level. Those audits shall be optional for certain types of beneficiaries and shall examine the systems and processes of a beneficiary, complemented by an audit of transactions. They shall be carried out by a competent independent auditor qualified to carry out statutory audits of accounting documents in accordance with Directive 2006/43/EC of the European Parliament and of the Council (34). The system and processes audits may be used by the Commission or the relevant funding body to determine the overall assurance on the sound financial management of expenditure and for reconsideration of the level of ex post audits and certificates on financial statements.",8,1,,bbox_text
PAR-DOC-BMK-002-00760,DOC-BMK-002,48,13,heading,"4. In accordance with Article 127 of the Financial Regulation, the Commission or the relevant funding body may rely on audits on the use of Union contributions carried out by other independent and competent persons or entities, including by other than those mandated by the Union institutions or bodies.",4,1,,bbox_text
PAR-DOC-BMK-002-00761,DOC-BMK-002,48,14,heading,5. Audits may be carried out up to two years after the payment of the balance.,2,1,,bbox_text
PAR-DOC-BMK-002-00762,DOC-BMK-002,48,15,paragraph,"(34) Directive 2006/43/EC of the European Parliament and of the Council of 17 May 2006 on statutory audits of annual accounts and consolidated accounts, amending Council Directives 78/660/EEC and 83/349/EEC and repealing Council Directive 84/253/EEC (OJ L 157, 9.6.2006, p. 87).",3,1,,bbox_text
PAR-DOC-BMK-002-00763,DOC-BMK-002,49,1,paragraph,EN Official Journal of the European Union,2,1,,bbox_text
PAR-DOC-BMK-002-00764,DOC-BMK-002,49,2,heading,12.5.2021 L 170/49,2,1,,bbox_text
PAR-DOC-BMK-002-00765,DOC-BMK-002,49,3,heading,"6. The Commission shall publish audit guidelines, aiming to ensure the reliable and uniform application and interpretation of the audit procedures and rules throughout the duration of the Programme.",3,1,,bbox_text
PAR-DOC-BMK-002-00766,DOC-BMK-002,49,4,paragraph,Article 54 Protection of financial interests of the Union,2,2,merged_continuation,bbox_text
PAR-DOC-BMK-002-00767,DOC-BMK-002,49,5,paragraph,"Where a third country participates in the Programme by means of a decision adopted pursuant to an international agreement or on the basis of any other legal instrument, the third country shall grant the necessary rights and access required for the authorising officer responsible, OLAF and the Court of Auditors to comprehensively exercise their respective competences. In the case of OLAF, such rights shall include the right to carry out investigations, including on-the-spot checks and inspections, as provided for in Regulation (EU, Euratom) No 883/2013.",5,1,,bbox_text
PAR-DOC-BMK-002-00768,DOC-BMK-002,49,6,paragraph,Article 55 Exercise of the delegation,2,2,merged_continuation,bbox_text
PAR-DOC-BMK-002-00769,DOC-BMK-002,49,7,heading,1. The power to adopt delegated acts is conferred on the Commission subject to the conditions laid down in this Article.,2,1,,bbox_text
PAR-DOC-BMK-002-00770,DOC-BMK-002,49,8,heading,2. The power to adopt delegated acts referred to in Article 50(2) shall be conferred on the Commission until 31 December 2028.,3,1,,bbox_text
PAR-DOC-BMK-002-00771,DOC-BMK-002,49,9,heading,3. The delegation of power referred to in Article 50(2) may be revoked at any time by the European Parliament or by the Council. A decision to revoke shall put an end to the delegation of power specified in that decision. It shall take effect the day following the publication of the decision in the Official Journal of the European Union or at a later date specified therein. It shall not affect the validity of any delegated acts already in force.,5,1,,bbox_text
PAR-DOC-BMK-002-00772,DOC-BMK-002,49,10,heading,"4. Before adopting a delegated act, the Commission shall consult experts designated by each Member State in accordance with the principles laid down in the Interinstitutional Agreement of 13 April 2016 on Better Law-Making.",3,1,,bbox_text
PAR-DOC-BMK-002-00773,DOC-BMK-002,49,11,heading,"5. As soon as it adopts a delegated act, the Commission shall notify it simultaneously to the European Parliament and to the Council.",3,1,,bbox_text
PAR-DOC-BMK-002-00774,DOC-BMK-002,49,12,heading,"6. A delegated act adopted pursuant to Article 50(2) shall enter into force only if no objection has been expressed either by the European Parliament or by the Council within a period of two months of notification of that act to the European Parliament and to the Council or if, before the expiry of that period, the European Parliament and the Council have both informed the Commission that they will not object. That period shall be extended by two months at the initiative of the European Parliament or of the Council.",6,1,,bbox_text
PAR-DOC-BMK-002-00775,DOC-BMK-002,49,13,paragraph,TITLE IV TRANSITIONAL AND FINAL PROVISIONS Article 56 Repeal Regulations (EU) No 1290/2013 and (EU) No 1291/2013 are repealed with effect from 1 January 2021.,5,5,merged_continuation|merged_continuation|merged_continuation|merged_continuation,bbox_text
PAR-DOC-BMK-002-00776,DOC-BMK-002,50,1,paragraph,EN Official Journal of the European Union L 170/50,3,1,,bbox_text
PAR-DOC-BMK-002-00777,DOC-BMK-002,50,2,heading,12.5.2021,1,1,,bbox_text
PAR-DOC-BMK-002-00778,DOC-BMK-002,50,3,paragraph,Article 57 Transitional provisions,2,2,merged_continuation,bbox_text
PAR-DOC-BMK-002-00779,DOC-BMK-002,50,4,heading,"1. This Regulation shall not affect the continuation of or modification of actions initiated pursuant to Regulations (EU) No 1290/2013 and (EU) No 1291/2013, which shall continue to apply to those actions until their closure. Work plans and actions provided for in work plans adopted under Regulation (EU) No 1290/2013 and under the corresponding funding bodies' basic acts shall also continue to be governed by Regulation (EU) No 1290/2013 and those basic acts until their completion.",6,1,,bbox_text
PAR-DOC-BMK-002-00780,DOC-BMK-002,50,5,heading,2. The financial envelope for the Programme may also cover technical and administrative assistance expenses necessary to ensure the transition between the Programme and the measures adopted pursuant to Regulation (EU) No 1291/2013.,3,1,,bbox_text
PAR-DOC-BMK-002-00781,DOC-BMK-002,50,6,paragraph,Article 58 Entry into force This Regulation shall enter into force on the day of its publication in the Official Journal of the European Union.,3,3,merged_continuation|merged_continuation,bbox_text
PAR-DOC-BMK-002-00782,DOC-BMK-002,50,7,paragraph,It shall apply from 1 January 2021.,1,1,,bbox_text
PAR-DOC-BMK-002-00783,DOC-BMK-002,50,8,paragraph,This Regulation shall be binding in its entirety and directly applicable in all Member States.,1,1,,bbox_text
PAR-DOC-BMK-002-00784,DOC-BMK-002,50,9,paragraph,"Done at Brussels, 28 April 2021.",1,1,,bbox_text
PAR-DOC-BMK-002-00785,DOC-BMK-002,50,10,paragraph,For the European Parliament For the Council The President D. M. SASSOLI,4,3,merged_continuation|merged_continuation,bbox_text
PAR-DOC-BMK-002-00786,DOC-BMK-002,50,11,paragraph,The President A. P. ZACARIAS,2,1,,bbox_text
PAR-DOC-BMK-002-00787,DOC-BMK-002,51,1,paragraph,EN Official Journal of the European Union,2,1,,bbox_text
PAR-DOC-BMK-002-00788,DOC-BMK-002,51,2,heading,12.5.2021 L 170/51,2,1,,bbox_text
PAR-DOC-BMK-002-00789,DOC-BMK-002,51,3,paragraph,ANNEX I BROAD LINES OF ACTIVITIES,2,2,merged_continuation,bbox_text
PAR-DOC-BMK-002-00790,DOC-BMK-002,51,4,paragraph,"The general and specific objectives referred to in Article 3 of this Regulation shall be pursued across the Programme, through the areas of intervention and the broad lines of activities described in this Annex and in Annex II to this Regulation, as well as in Annex I to Decision (EU) 2021/764.",3,1,,bbox_text
PAR-DOC-BMK-002-00791,DOC-BMK-002,51,5,paragraph,"(1) Pillar I 'Excellent Science' Through the following activities, this pillar shall, in line with Article 4, promote scientific excellence, attract the best talent to Europe, provide appropriate support to early-stage researchers and support the creation and diffusion of scientific excellence, high-quality knowledge, methodologies and skills, technologies and solutions to global social, environmental and economic challenges. It shall also contribute to the other specific objectives of the Programme as referred to in Article 3.",6,2,merged_continuation,bbox_text
PAR-DOC-BMK-002-00792,DOC-BMK-002,51,6,paragraph,"(a) ERC: providing attractive and flexible funding to enable talented and creative individual researchers, with an emphasis on early stage researchers, and their teams to pursue the most promising avenues at the frontier of science, regardless of their nationality and country of origin and on the basis of Union-wide competition based solely on the criterion of excellence.",4,1,,bbox_text
PAR-DOC-BMK-002-00793,DOC-BMK-002,51,7,paragraph,Area of intervention: Frontier science.,1,1,,bbox_text
PAR-DOC-BMK-002-00794,DOC-BMK-002,51,8,paragraph,"(b) MSCA: equipping researchers with new knowledge and skills through mobility and exposure across borders, sectors and disciplines, enhancing training and career development systems as well as structuring and improving institutional and national recruitment, taking into account the European Charter for Researchers and the Code of Conduct for the recruitment of researchers; in so doing, the MSCA help to lay the foundations of Europe's excellent research landscape across the whole of Europe, contributing to boosting jobs, growth, and investment, and solving current and future societal challenges.",6,1,,bbox_text
PAR-DOC-BMK-002-00795,DOC-BMK-002,51,9,paragraph,"Areas of intervention: nurturing excellence through the mobility of researchers across borders, sectors and disciplines; fostering new skills through the excellent training of researchers; strengthening human resources and skills development across the ERA; improving and facilitating synergies; promoting public outreach.",3,1,,bbox_text
PAR-DOC-BMK-002-00796,DOC-BMK-002,51,10,paragraph,"(c) Research infrastructures: endowing Europe with world-class sustainable research infrastructures which are open and accessible to the best researchers from Europe and beyond. Encouraging the use of existing research infrastructures, including those financed from funds under Union Cohesion Policy. In so doing, enhancing the potential of the research infrastructure to support scientific advance and innovation, and to enable open and excellent science in accordance with the FAIR principles, alongside activities related to Union policies and international cooperation.",6,1,,bbox_text
PAR-DOC-BMK-002-00797,DOC-BMK-002,51,11,paragraph,"Areas of intervention: consolidating and developing the landscape of European research infrastructures; opening, integrating and interconnecting research infrastructures; the innovation potential of European research infrastructures and activities for innovation and training; reinforcing European research infrastructure policy and international cooperation.",4,1,,bbox_text
PAR-DOC-BMK-002-00798,DOC-BMK-002,51,12,paragraph,"(2) Pillar II 'Global Challenges and European Industrial Competitiveness' Through the following activities, this pillar shall, in line with Article 4, support the creation and better diffusion of high-quality new knowledge, technologies and sustainable solutions, reinforce the European industrial competitiveness, strengthen the impact of R&I in developing, supporting and implementing Union policies, and support the uptake of innovative solutions in industry, in particular in SMEs and start-ups, and society to address global challenges. It shall also contribute to the other specific objectives of the Programme as referred to in Article 3.",6,2,merged_continuation,bbox_text
PAR-DOC-BMK-002-00799,DOC-BMK-002,51,13,paragraph,"SSH shall be fully integrated across all clusters, including specific and dedicated activities.",1,1,,bbox_text
PAR-DOC-BMK-002-00800,DOC-BMK-002,52,1,paragraph,EN Official Journal of the European Union L 170/52,3,1,,bbox_text
PAR-DOC-BMK-002-00801,DOC-BMK-002,52,2,heading,12.5.2021,1,1,,bbox_text
PAR-DOC-BMK-002-00802,DOC-BMK-002,52,3,paragraph,"To maximise impact, flexibility and synergies, R&I activities shall be organised in six clusters, interconnected through pan-European research infrastructures, which individually and together incentivise interdisciplinary, cross-sectoral, cross-policy, cross-border and international cooperation. Pillar II of the Programme shall cover activities from a broad range of TRLs, including lower TRLs.",4,1,,bbox_text
PAR-DOC-BMK-002-00803,DOC-BMK-002,52,4,paragraph,Each cluster contributes towards several SDGs and many SDGs are supported by more than one cluster.,1,1,,bbox_text
PAR-DOC-BMK-002-00804,DOC-BMK-002,52,5,paragraph,The R&I activities shall be implemented in and across the following clusters:,1,1,,bbox_text
PAR-DOC-BMK-002-00805,DOC-BMK-002,52,6,paragraph,"(a) Cluster 'Health': improving and protecting the health and well-being of citizens of all ages by generating new knowledge, developing innovative solutions, ensuring to integrate, where relevant, a gender perspective to prevent, diagnose, monitor, treat and cure diseases, and developing health technologies; mitigating health risks; protecting populations and promoting good health and well-being, also in the work place; making public health systems more cost-effective, equitable and sustainable; preventing and tackling poverty-related diseases; and supporting and enabling patients' participation and self-management.",6,1,,bbox_text
PAR-DOC-BMK-002-00806,DOC-BMK-002,52,7,paragraph,"Areas of intervention: health throughout the life course; environmental and social health determinants; non- communicable and rare diseases; infectious diseases, including poverty-related and neglected diseases; tools, technologies and digital solutions for health and care, including personalised medicine; health care systems.",3,1,,bbox_text
PAR-DOC-BMK-002-00807,DOC-BMK-002,52,8,paragraph,"(b) Cluster 'Culture, Creativity and Inclusive Society': strengthening democratic values, including rule of law and fundamental rights; safeguarding our cultural heritage; exploring the potential of cultural and creative sectors, and promoting socio-economic transformations that contribute to inclusion and growth, including migration management and integration of migrants.",4,1,,bbox_text
PAR-DOC-BMK-002-00808,DOC-BMK-002,52,9,paragraph,"Areas of intervention: democracy and governance; culture, cultural heritage and creativity; social and economic transformations.",2,1,,bbox_text
PAR-DOC-BMK-002-00809,DOC-BMK-002,52,10,paragraph,"(c) Cluster 'Civil Security for Society': responding to the challenges arising from persistent security threats, including cybercrime, as well as natural and man-made disasters.",2,1,,bbox_text
PAR-DOC-BMK-002-00810,DOC-BMK-002,52,11,paragraph,Areas of intervention: disaster-resilient societies; protection and security; cybersecurity.,1,1,,bbox_text
PAR-DOC-BMK-002-00811,DOC-BMK-002,52,12,paragraph,"(d) Cluster 'Digital, Industry and Space': reinforcing capacities and securing Europe's sovereignty in key enabling technologies for digitisation and production, and in space technology, all along the value chain; to build a competitive, digital, low-carbon and circular industry; ensure a sustainable supply of raw materials; develop advanced materials and provide the basis for advances and innovation in global societal challenges.",4,1,,bbox_text
PAR-DOC-BMK-002-00812,DOC-BMK-002,52,13,paragraph,"Areas of intervention: manufacturing technologies; key digital technologies, including quantum technologies; emerging enabling technologies; advanced materials; artificial intelligence and robotics; next generation internet; advanced computing and Big Data; circular industries; low carbon and clean industries; space, including earth observation.",4,1,,bbox_text
PAR-DOC-BMK-002-00813,DOC-BMK-002,52,14,paragraph,"(e) Cluster 'Climate, Energy and Mobility': fighting climate change by better understanding its causes, evolution, risks, impacts and opportunities, by making the energy and transport sectors more climate and environment-friendly, more efficient and competitive, smarter, safer and more resilient, promote the use of renewable energy sources and energy efficiency, improve the resilience of the Union to external shocks and adapt social behaviour in view of the SDGs.",5,1,,bbox_text
PAR-DOC-BMK-002-00814,DOC-BMK-002,52,15,paragraph,"Areas of intervention: climate science and solutions; energy supply; energy systems and grids; buildings and industrial facilities in energy transition; communities and cities; industrial competitiveness in transport; clean, safe and accessible transport and mobility; smart mobility; energy storage.",3,1,,bbox_text
PAR-DOC-BMK-002-00815,DOC-BMK-002,52,16,paragraph,"(f) Cluster 'Food, Bioeconomy, Natural Resources, Agriculture and Environment': protecting the environment, restoring, sustainably managing and using natural and biological resources from land, inland waters and sea to stop biodiversity erosion, to address food and nutrition security for all and the transition to a low carbon, resource efficient and circular economy and sustainable bioeconomy.",5,1,,bbox_text
PAR-DOC-BMK-002-00816,DOC-BMK-002,53,1,paragraph,EN Official Journal of the European Union,2,1,,bbox_text
PAR-DOC-BMK-002-00817,DOC-BMK-002,53,2,heading,12.5.2021 L 170/53,2,1,,bbox_text
PAR-DOC-BMK-002-00818,DOC-BMK-002,53,3,paragraph,"Areas of intervention: environmental observation; biodiversity and natural resources; agriculture, forestry and rural areas; seas, oceans and inland waters; food systems; bio-based innovation systems in the Union's bioeconomy; circular systems.",3,1,,bbox_text
PAR-DOC-BMK-002-00819,DOC-BMK-002,53,4,paragraph,"(g) Non-nuclear direct actions of the JRC: generating high-quality scientific evidence for efficient and affordable good public policies. New initiatives and proposals for Union legal acts need transparent, comprehensive and balanced evidence to be sensibly designed, whereas implementation of policies needs evidence to be measured and monitored. The JRC provides Union policies with independent scientific evidence and technical support throughout the policy cycle. The JRC focuses its research on Union policy priorities.",5,1,,bbox_text
PAR-DOC-BMK-002-00820,DOC-BMK-002,53,5,paragraph,"Areas of intervention: strengthening the knowledge base for policy making; global challenges (health; culture, creativity and inclusive society; civil security for society; digital, industry and space; climate, energy and mobility; food, bioeconomy, natural resources, agriculture and environment); innovation, economic development, and competitiveness; scientific excellence; territorial development and support for Member States and regions.",4,1,,bbox_text
PAR-DOC-BMK-002-00821,DOC-BMK-002,53,6,paragraph,"(3) Pillar III 'Innovative Europe' Through the following activities, this pillar shall, in line with Article 4, foster all forms of innovation, including non- technological innovation, primarily within SMEs including start-ups, by facilitating technological development, demonstration and knowledge transfer, and strengthen deployment of innovative solutions. It shall also contribute to the other specific objectives of the Programme as referred to in Article 3. The EIC shall be implemented primarily through two instruments, the Pathfinder, implemented mainly through collaborative research, and the Accelerator.",6,2,merged_continuation,bbox_text
PAR-DOC-BMK-002-00822,DOC-BMK-002,53,7,paragraph,"(a) EIC: focusing mainly on breakthrough and disruptive innovation, targeting especially market-creating innovation, while also supporting all types of innovation, including incremental innovation.",2,1,,bbox_text
PAR-DOC-BMK-002-00823,DOC-BMK-002,53,8,paragraph,"Areas of intervention: Pathfinder for advanced research, supporting future and emerging breakthrough, market- creating and/or deep tech technologies; the Accelerator, bridging the financing gap between late stages of R&I activities and market take-up, to effectively deploy breakthrough, market-creating innovation and scale up companies where the market does not provide viable financing; additional EIC activities such as prizes and fellowships, and business added-value services.",5,1,,bbox_text
PAR-DOC-BMK-002-00824,DOC-BMK-002,53,9,paragraph,"(b) European innovation ecosystems Areas of intervention: activities including in particular connecting, where relevant in cooperation with the EIT, with national and regional innovation actors and supporting the implementation of joint cross-border innovation programmes by Member States, Regions and associated countries, from the exchange of practice and knowledge on innovation regulation to the enhancement of soft skills for innovation to research and innovation activities, including open or user-led innovation, to boost the effectiveness of the European innovation system. This should be implemented in synergy with, among others, the ERDF support for innovation eco-systems and interregional partnerships around smart specialisation topics.",8,2,merged_continuation,bbox_text
PAR-DOC-BMK-002-00825,DOC-BMK-002,53,10,paragraph,"(c) The European Institute of Innovation and Technology Areas of intervention (defined in Annex II): sustainable innovation ecosystems across Europe; innovation and entrepreneurial skills in a lifelong learning perspective, including increasing capacities of higher education institutions across Europe; new solutions to market to address global challenges; synergies and value added within the Programme.",5,2,merged_continuation,bbox_text
PAR-DOC-BMK-002-00826,DOC-BMK-002,53,11,paragraph,"(4) Part 'Widening Participation and Strengthening the ERA' Through the following activities, this part shall pursue the specific objectives as set out in point (d) of Article 3(2). It shall also contribute to the other specific objectives of the Programme as referred to in Article 3. While underpinning the entire Programme, this part shall support activities that contribute to attracting talent, fostering brain circulation and preventing brain drain, a more knowledge-based and innovative and gender-equal Europe, at the front edge of global competition, fostering transnational cooperation and thereby optimising national strengths and potential across the whole Europe in a well-performing ERA, where knowledge and a highly skilled workforce circulate freely in a balanced manner, where the results of R&I are widely disseminated to as well as understood and trusted by informed citizens and benefit society as a whole, and where Union policy, in particular R&I policy, is based on high quality scientific evidence.",10,2,merged_continuation,bbox_text
PAR-DOC-BMK-002-00827,DOC-BMK-002,54,1,paragraph,EN Official Journal of the European Union L 170/54,3,1,,bbox_text
