paragraph_id,document_id,page_no,page_block_order,block_type,text,source_line_count,merged_block_count,normalization_actions,source_mode
PAR-DOC-BMK-002-00156,DOC-BMK-002,15,13,paragraph,"(6) 'mission' means a portfolio of excellence-based and impact-driven R&I activities across disciplines and sectors, intended to: (i) achieve, within a set timeframe, a measurable goal that could not be achieved through individual actions; (ii) have an impact on society and policy-making through science and technology; and (iii) be relevant for a significant part of the European population and a wide range of European citizens;",5,1,,bbox_text
PAR-DOC-BMK-002-00157,DOC-BMK-002,15,14,paragraph,"(7) 'pre-commercial procurement' means the procurement of research and development services involving risk-benefit sharing under market conditions, and competitive development in phases, where there is a clear separation of the research and development services procured from the deployment of commercial volumes of end-products;",4,1,,bbox_text
PAR-DOC-BMK-002-00158,DOC-BMK-002,15,15,paragraph,"(8) 'public procurement of innovative solutions' means procurement where contracting authorities act as a launch customer for innovative goods or services which are not yet available on a large-scale commercial basis, and may include conformity testing;",4,1,,bbox_text
PAR-DOC-BMK-002-00159,DOC-BMK-002,16,1,paragraph,EN Official Journal of the European Union L 170/16,3,1,,bbox_text
PAR-DOC-BMK-002-00160,DOC-BMK-002,16,2,heading,12.5.2021,1,1,,bbox_text
PAR-DOC-BMK-002-00161,DOC-BMK-002,16,3,paragraph,(9) 'access rights' means rights to use results or background under terms and conditions laid down in accordance with this Regulation;,3,1,,bbox_text
PAR-DOC-BMK-002-00162,DOC-BMK-002,16,4,paragraph,"(10) 'background' means any data, know how or information whatever its form or nature, tangible or intangible, including any rights such as intellectual property rights, that is: (i) held by beneficiaries prior to their accession to a given action; and (ii) identified by the beneficiaries in a written agreement as needed for implementing the action or for exploiting its results;",4,1,,bbox_text
PAR-DOC-BMK-002-00163,DOC-BMK-002,16,5,paragraph,"(11) 'dissemination' means the public disclosure of the results by appropriate means, other than resulting from protecting or exploiting the results, including by scientific publications in any medium;",2,1,,bbox_text
PAR-DOC-BMK-002-00164,DOC-BMK-002,16,6,paragraph,"(12) 'exploitation' means the use of results in further R&I activities other than those covered by the action concerned, including among other things, commercial exploitation such as developing, creating, manufacturing and marketing a product or process, creating and providing a service, or in standardisation activities;",3,1,,bbox_text
PAR-DOC-BMK-002-00165,DOC-BMK-002,16,7,paragraph,"(13) 'fair and reasonable conditions' means appropriate conditions, including possible financial terms or royalty-free conditions, taking into account the specific circumstances of the request for access, for example the actual or potential value of the results or background to which access is requested and/or the scope, duration or other characteristics of the exploitation envisaged;",4,1,,bbox_text
PAR-DOC-BMK-002-00166,DOC-BMK-002,16,8,paragraph,"(14) 'funding body' means a body or organisation, as referred to in point (c) of Article 62(1) of the Financial Regulation, to which the Commission has entrusted budget implementation tasks under the Programme;",2,1,,bbox_text
PAR-DOC-BMK-002-00167,DOC-BMK-002,16,9,paragraph,"(15) 'international European research organisation' means an international organisation, the majority of whose members are Member States or associated countries, whose principal objective is to promote scientific and technological cooperation in Europe;",3,1,,bbox_text
PAR-DOC-BMK-002-00168,DOC-BMK-002,16,10,paragraph,"(16) 'legal entity' means a natural person, or a legal person created and recognised as such under Union, national or international law, which has legal personality and the capacity to act in its own name, exercise rights and be subject to obligations, or an entity which does not have legal personality as referred to in point (c) of Article 197(2) of the Financial Regulation;",4,1,,bbox_text
PAR-DOC-BMK-002-00169,DOC-BMK-002,16,11,paragraph,"(17) 'widening countries' or 'low R&I performing countries' means countries where legal entities need to be established in order to be eligible as coordinators under the 'widening participation and spreading excellence' component of the 'Widening Participation and Strengthening ERA' part of the Programme; from the Member States, those countries are Bulgaria, Croatia, Cyprus, Czechia, Estonia, Greece, Hungary, Latvia, Lithuania, Malta, Poland, Portugal, Romania, Slovakia and Slovenia, for the whole duration of the Programme; for associated countries, it means the list of eligible countries as defined based on an indicator and published in the work programme. Legal entities from outermost regions as defined in Article 349 TFUE shall be also fully eligible as coordinators under this component;",7,1,,bbox_text
PAR-DOC-BMK-002-00170,DOC-BMK-002,16,12,paragraph,(18) 'non-profit legal entity' means a legal entity which by its legal form is non-profit-making or which has a legal or statutory obligation not to distribute profits to its shareholders or individual members;,2,1,,bbox_text
PAR-DOC-BMK-002-00171,DOC-BMK-002,16,13,paragraph,"(19) 'small or medium-sized enterprise' or 'SME' means a micro, small or medium-sized enterprise as defined in Article 2 of the Annex to Recommendation 2003/361/EC (27);",2,1,,bbox_text
PAR-DOC-BMK-002-00172,DOC-BMK-002,16,14,paragraph,(20) 'small mid-cap' means an entity that is not an SME and that has up to 499 employees where the staff headcount is calculated in accordance with Articles 3 to 6 of Annex to Recommendation 2003/361/EC;,2,1,,bbox_text
PAR-DOC-BMK-002-00173,DOC-BMK-002,16,15,paragraph,"(21) 'results' means any tangible or intangible effect of a given action, such as data, knowhow or information, whatever its form or nature and whether or not it can be protected, as well as any rights attached to it, including intellectual property rights;",3,1,,bbox_text
PAR-DOC-BMK-002-00174,DOC-BMK-002,16,16,paragraph,"(27) Commission Recommendation 2003/361/EC of 6 May 2003 concerning the definition of micro, small and medium-sized enterprises (OJ L 124, 20.5.2003, p. 36).",2,1,,bbox_text
PAR-DOC-BMK-002-00175,DOC-BMK-002,17,1,paragraph,EN Official Journal of the European Union,2,1,,bbox_text
PAR-DOC-BMK-002-00176,DOC-BMK-002,17,2,heading,12.5.2021 L 170/17,2,1,,bbox_text
PAR-DOC-BMK-002-00177,DOC-BMK-002,17,3,paragraph,"(22) 'research output' means the results generated by a given action to which access can be given in the form of scientific publications, data or other engineered results and processes such as software, algorithms, protocols and electronic notebooks;",3,1,,bbox_text
PAR-DOC-BMK-002-00178,DOC-BMK-002,17,4,paragraph,"(23) 'Seal of Excellence' means a quality label which shows that a proposal submitted to a call for proposals exceeded all of the evaluation thresholds set out in the work programme, but could not be funded due to lack of budget available for that call for proposals in the work programme and might receive support from other Union or national sources of funding;",4,1,,bbox_text
PAR-DOC-BMK-002-00179,DOC-BMK-002,17,5,paragraph,"(24) 'strategic R&I plan' means an implementing act laying out a strategy for realising content in the work programme covering a maximum period of four years, follows a broad mandatory multi-stakeholder consultation process and specifies the priorities, suitable types of action and forms of implementation to be used;",3,1,,bbox_text
PAR-DOC-BMK-002-00180,DOC-BMK-002,17,6,paragraph,(25) 'work programme' means a document adopted by the Commission for the implementation of the specific programme in accordance with Article 14 of Decision (EU) 2021/764 or a document equivalent in content and structure adopted by a funding body;,3,1,,bbox_text
PAR-DOC-BMK-002-00181,DOC-BMK-002,17,7,paragraph,(26) 'contract' means an agreement concluded between the Commission or the relevant funding body with a legal entity implementing an innovation and market deployment action and supported by Horizon Europe blended finance or EIC blended finance;,3,1,,bbox_text
PAR-DOC-BMK-002-00182,DOC-BMK-002,17,8,paragraph,"(27) 'reimbursable advance' means the part of the Horizon Europe blended finance or EIC blended finance that corresponds to a loan under Title X of the Financial Regulation, but that is directly awarded by the Union on a non- profit basis to cover the costs of activities corresponding to an innovation action, and which is to be reimbursed by the beneficiary to the Union under the conditions provided for in the contract;",4,1,,bbox_text
PAR-DOC-BMK-002-00183,DOC-BMK-002,17,9,paragraph,"(28) 'classified information' means European Union classified information as defined in Article 3 of Decision (EU, Euratom) 2015/444 as well as classified information of Member States, classified information of third countries with which the Union has a security agreement and classified information of international organisation with which the Union has a security agreement;",4,1,,bbox_text
PAR-DOC-BMK-002-00184,DOC-BMK-002,17,10,paragraph,"(29) 'blending operation' means an action supported by the Union budget, including within a blending facility or platform as defined in point (6) of Article 2 of the Financial Regulation, that combines non-repayable forms of support and/or financial instruments from the Union budget with repayable forms of support from development or other public finance institutions, as well as from commercial finance institutions and investors;",4,1,,bbox_text
PAR-DOC-BMK-002-00185,DOC-BMK-002,17,11,paragraph,"(30) 'Horizon Europe blended finance' means financial support to a programme implementing innovation and market deployment action, consisting of a specific combination of a grant or reimbursable advance and an investment in equity or any other repayable form of support;",3,1,,bbox_text
PAR-DOC-BMK-002-00186,DOC-BMK-002,17,12,paragraph,(31) 'EIC blended finance' means direct financial support provided under the EIC to an innovation and market deployment action consisting of a specific combination of a grant or reimbursable advance and an investment in equity or any other repayable form of support;,3,1,,bbox_text
PAR-DOC-BMK-002-00187,DOC-BMK-002,17,13,paragraph,"(32) 'research and innovation action' means an action primarily consisting of activities aiming to establish new knowledge or to explore the feasibility of a new or improved technology, product, process, service or solution. This may include basic and applied research, technology development and integration, testing, demonstration and validation on a small-scale prototype in a laboratory or simulated environment;",4,1,,bbox_text
PAR-DOC-BMK-002-00188,DOC-BMK-002,17,14,paragraph,"(33) 'innovation action' means an action primarily consisting of activities directly aiming to produce plans and arrangements or designs for new, altered or improved products, processes or services, possibly including prototyping, testing, demonstrating, piloting, large-scale product validation and market replication;",3,1,,bbox_text
PAR-DOC-BMK-002-00189,DOC-BMK-002,17,15,paragraph,"(34) 'ERC frontier research action' means a principal investigator-led research action, including ERC Proof of Concept, hosted by single or multiple beneficiaries receiving funding from the European Research Council (ERC);",2,1,,bbox_text
PAR-DOC-BMK-002-00190,DOC-BMK-002,17,16,paragraph,"(35) 'training and mobility action' means an action geared towards the improvement of the skills, knowledge and career prospects of researchers, based on mobility between countries and, if relevant, between sectors or disciplines;",2,1,,bbox_text
PAR-DOC-BMK-002-00191,DOC-BMK-002,18,1,paragraph,EN Official Journal of the European Union L 170/18,3,1,,bbox_text
PAR-DOC-BMK-002-00192,DOC-BMK-002,18,2,heading,12.5.2021,1,1,,bbox_text
PAR-DOC-BMK-002-00193,DOC-BMK-002,18,3,paragraph,"(36) 'programme co-fund action' means an action to provide multi-annual co-funding to a programme of activities established or implemented by legal entities managing or funding R&I programmes, other than Union funding bodies; such a programme of activities may support networking and coordination, research, innovation, pilot actions, and innovation and market deployment actions, training and mobility actions, awareness raising and communication, dissemination and exploitation, and provide any relevant financial support, such as grants, prizes and procurement, as well as Horizon Europe blended finance or a combination thereof. The programme co-fund action may be implemented by those legal entities directly or by third parties on their behalf;",7,1,,bbox_text
PAR-DOC-BMK-002-00194,DOC-BMK-002,18,4,paragraph,(37) 'pre-commercial procurement action' means an action the primary aim of which is to realise the pre-commercial procurement implemented by beneficiaries that are contracting authorities or contracting entities;,2,1,,bbox_text
PAR-DOC-BMK-002-00195,DOC-BMK-002,18,5,paragraph,(38) 'public procurement of innovative solutions action' means an action the primary aim of which is to realise the joint or coordinated public procurement of innovative solutions implemented by beneficiaries that are contracting authorities or contracting entities;,3,1,,bbox_text
PAR-DOC-BMK-002-00196,DOC-BMK-002,18,6,paragraph,"(39) 'coordination and support action' means an action contributing to the objectives of the Programme, excluding R&I activities, except when undertaken under the component 'widening participation and spreading excellence' of the part 'Widening participation and strengthening the ERA'; and bottom-up coordination without co-funding of research activities from the Union that allows for cooperation between legal entities from Member States and associated countries in order to strengthen the ERA;",5,1,,bbox_text
PAR-DOC-BMK-002-00197,DOC-BMK-002,18,7,paragraph,(40) 'inducement prize' means a prize to spur investment in a given direction by specifying a target prior to the performance of the work;,2,1,,bbox_text
PAR-DOC-BMK-002-00198,DOC-BMK-002,18,8,paragraph,(41) 'recognition prize' means a prize to reward past achievements and outstanding work after it has been performed;,1,1,,bbox_text
PAR-DOC-BMK-002-00199,DOC-BMK-002,18,9,paragraph,"(42) 'innovation and market deployment action' means an action which embeds an innovation action and other activities necessary to deploy an innovation in the market, including the scaling-up of companies, Horizon Europe blended finance or EIC blended finance;",3,1,,bbox_text
PAR-DOC-BMK-002-00200,DOC-BMK-002,18,10,paragraph,(43) 'indirect actions' means R&I activities to which the Union provides financial support and which are undertaken by participants;,2,1,,bbox_text
PAR-DOC-BMK-002-00201,DOC-BMK-002,18,11,paragraph,(44) 'direct actions' means R&I activities undertaken by the Commission through its JRC;,1,1,,bbox_text
PAR-DOC-BMK-002-00202,DOC-BMK-002,18,12,paragraph,(45) 'procurement' means procurement as defined in point (49) of Article 2 of the Financial Regulation;,1,1,,bbox_text
PAR-DOC-BMK-002-00203,DOC-BMK-002,18,13,paragraph,(46) 'affiliated entity' means an entity as defined in Article 187(1) of the Financial Regulation;,1,1,,bbox_text
PAR-DOC-BMK-002-00204,DOC-BMK-002,18,14,paragraph,"(47) 'innovation ecosystem' means an ecosystem that brings together at Union level actors or entities whose functional goal is to enable technology development and innovation; it encompasses relations between material resources (such as funds, equipment, and facilities), institutional entities (such as higher education institutions and support services, research and technology organisations, companies, venture capitalists and financial intermediaries) and national, regional and local policy-making and funding entities;",5,1,,bbox_text
PAR-DOC-BMK-002-00205,DOC-BMK-002,18,15,paragraph,"(48) 'project-based remuneration' means remuneration that is linked to the participation of a person in projects, is part of the beneficiary's usual remuneration practices and is paid in a consistent manner.",2,1,,bbox_text
PAR-DOC-BMK-002-00206,DOC-BMK-002,18,16,paragraph,Article 3 Programme objectives,2,2,merged_continuation,bbox_text
PAR-DOC-BMK-002-00207,DOC-BMK-002,18,17,heading,"1. The general objective of the Programme is to deliver scientific, technological, economic and societal impact from the Union's investments in R&I so as to strengthen the scientific and technological bases of the Union and foster the competitiveness of the Union in all Member States including in its industry, to deliver on the Union strategic priorities and to contribute to the realisation of Union objectives and policies, to tackle global challenges, including the SDGs by following the principles of the 2030 Agenda and the Paris Agreement, and to strengthen the ERA. The Programme shall thus maximise Union added value by focusing on objectives and activities that cannot be effectively realised by Member States acting alone, but in cooperation.",8,1,,bbox_text
PAR-DOC-BMK-002-00208,DOC-BMK-002,19,1,paragraph,EN Official Journal of the European Union,2,1,,bbox_text
PAR-DOC-BMK-002-00209,DOC-BMK-002,19,2,heading,12.5.2021 L 170/19,2,1,,bbox_text
PAR-DOC-BMK-002-00210,DOC-BMK-002,19,3,heading,2. The Programme has the following specific objectives:,2,1,,bbox_text
PAR-DOC-BMK-002-00211,DOC-BMK-002,19,4,paragraph,"(a) to develop, promote and advance scientific excellence, to support the creation and diffusion of high-quality new fundamental and applied knowledge, of skills, technologies and solutions, to support training and mobility of researchers, to attract talent at all levels and contribute to the full engagement of the Union's talent pool in actions supported under the Programme;",4,1,,bbox_text
PAR-DOC-BMK-002-00212,DOC-BMK-002,19,5,paragraph,"(b) to generate knowledge, strengthen the impact of R&I in developing, supporting and implementing Union policies and support the access to and uptake of innovative solutions in European industry, in particular SMEs, and in society to address global challenges, including climate change and the SDGs;",3,1,,bbox_text
PAR-DOC-BMK-002-00213,DOC-BMK-002,19,6,paragraph,"(c) to foster all forms of innovation, facilitate technological development, demonstration and knowledge and technology transfer, strengthen deployment and exploitation of innovative solutions;",2,1,,bbox_text
PAR-DOC-BMK-002-00214,DOC-BMK-002,19,7,paragraph,"(d) to optimise the Programme's delivery with a view to strengthening and increasing the impact and attractiveness of the ERA, to foster excellence-based participation from all Member States, including low R&I performing countries, in the Programme and to facilitate collaborative links in European R&I.",3,1,,bbox_text
PAR-DOC-BMK-002-00215,DOC-BMK-002,19,8,paragraph,Article 4 Programme structure,2,2,merged_continuation,bbox_text
PAR-DOC-BMK-002-00216,DOC-BMK-002,19,9,heading,"1. For the specific programme referred to in point (a) of Article 1(2) and the EIT, the Programme shall be structured in parts as follows, which contribute to the general and specific objectives set out in Article 3:",3,1,,bbox_text
PAR-DOC-BMK-002-00217,DOC-BMK-002,19,10,paragraph,"(a) Pillar I 'Excellent Science', with the following components:",1,1,,bbox_text
PAR-DOC-BMK-002-00218,DOC-BMK-002,19,11,paragraph,(i) the ERC;,2,1,,bbox_text
PAR-DOC-BMK-002-00219,DOC-BMK-002,19,12,paragraph,(ii) Marie Skłodowska-Curie Actions (MSCA);,2,1,,bbox_text
PAR-DOC-BMK-002-00220,DOC-BMK-002,19,13,paragraph,(iii) research infrastructures;,1,1,,bbox_text
PAR-DOC-BMK-002-00221,DOC-BMK-002,19,14,paragraph,"(b) Pillar II 'Global Challenges and European Industrial Competitiveness', with the following components, taking into account that SSH play an important role across all clusters:",2,1,,bbox_text
PAR-DOC-BMK-002-00222,DOC-BMK-002,19,15,paragraph,(i) cluster 'Health';,2,1,,bbox_text
PAR-DOC-BMK-002-00223,DOC-BMK-002,19,16,paragraph,"(ii) cluster 'Culture, Creativity and Inclusive Society';",2,1,,bbox_text
PAR-DOC-BMK-002-00224,DOC-BMK-002,19,17,paragraph,(iii) cluster 'Civil Security for Society';,2,1,,bbox_text
PAR-DOC-BMK-002-00225,DOC-BMK-002,19,18,paragraph,"(iv) cluster 'Digital, Industry and Space';",2,1,,bbox_text
PAR-DOC-BMK-002-00226,DOC-BMK-002,19,19,paragraph,"(v) cluster 'Climate, Energy and Mobility';",2,1,,bbox_text
PAR-DOC-BMK-002-00227,DOC-BMK-002,19,20,paragraph,"(vi) cluster 'Food, Bioeconomy, Natural Resources, Agriculture and Environment';",2,1,,bbox_text
PAR-DOC-BMK-002-00228,DOC-BMK-002,19,21,paragraph,(vii) non-nuclear direct actions of the JRC;,1,1,,bbox_text
PAR-DOC-BMK-002-00229,DOC-BMK-002,19,22,paragraph,"(c) Pillar III 'Innovative Europe', with the following components:",1,1,,bbox_text
PAR-DOC-BMK-002-00230,DOC-BMK-002,19,23,paragraph,(i) the EIC;,2,1,,bbox_text
PAR-DOC-BMK-002-00231,DOC-BMK-002,19,24,paragraph,(ii) European innovation ecosystems;,2,1,,bbox_text
PAR-DOC-BMK-002-00232,DOC-BMK-002,19,25,paragraph,(iii) the EIT;,1,1,,bbox_text
PAR-DOC-BMK-002-00233,DOC-BMK-002,19,26,paragraph,"(d) Part 'Widening Participation and Strengthening the ERA', with the following components:",1,1,,bbox_text
PAR-DOC-BMK-002-00234,DOC-BMK-002,19,27,paragraph,(i) widening participation and spreading excellence;,2,1,,bbox_text
PAR-DOC-BMK-002-00235,DOC-BMK-002,19,28,paragraph,(ii) reforming and enhancing the European R&I System.,1,1,,bbox_text
PAR-DOC-BMK-002-00236,DOC-BMK-002,19,29,heading,2. The broad lines of activities of the Programme are set out in Annex I of this Regulation.,2,1,,bbox_text
PAR-DOC-BMK-002-00237,DOC-BMK-002,20,1,paragraph,EN Official Journal of the European Union L 170/20,3,1,,bbox_text
PAR-DOC-BMK-002-00238,DOC-BMK-002,20,2,heading,12.5.2021,1,1,,bbox_text
PAR-DOC-BMK-002-00239,DOC-BMK-002,20,3,paragraph,Article 5 Defence research and development,2,2,merged_continuation,bbox_text
PAR-DOC-BMK-002-00240,DOC-BMK-002,20,4,paragraph,"Activities to be carried out under the specific programme referred to in point (c) of Article 1(2) and which are laid down in Regulation (EU) 2021/697, shall have an exclusive focus on defence research and development, with objectives and broad lines of activities aiming to foster the competitiveness, efficiency and innovation capacity of the European defence technological and industrial base.",4,1,,bbox_text
PAR-DOC-BMK-002-00241,DOC-BMK-002,20,5,paragraph,Article 6 Strategic planning and implementation and forms of Union funding,2,2,merged_continuation,bbox_text
PAR-DOC-BMK-002-00242,DOC-BMK-002,20,6,heading,1. The Programme shall be implemented by means of direct management or by means of indirect management by the funding bodies.,3,1,,bbox_text
PAR-DOC-BMK-002-00243,DOC-BMK-002,20,7,heading,"2. Funding under the Programme may be provided by means of indirect actions in any of the forms laid down in the Financial Regulation, however grants shall be the main form of support under the Programme. Funding under the Programme may also be provided through prizes, procurements and financial instruments within blending operations and equity support under the Accelerator.",5,1,,bbox_text
PAR-DOC-BMK-002-00244,DOC-BMK-002,20,8,heading,3. The rules for participation and dissemination laid down in this Regulation shall apply to indirect actions.,2,1,,bbox_text
PAR-DOC-BMK-002-00245,DOC-BMK-002,20,9,heading,4. The main types of action to be used under the Programme are defined in Article 2. The forms of funding referred to in paragraph 2 of this Article shall be used in a flexible manner across all objectives of the Programme with their use being determined on the basis of the needs and the characteristics of the particular objectives.,4,1,,bbox_text
PAR-DOC-BMK-002-00246,DOC-BMK-002,20,10,heading,"5. The Programme shall also support direct actions. Where those direct actions contribute to initiatives established under Article 185 or 187 TFEU, that contribution shall not be considered to be part of the financial contribution allocated to those initiatives.",4,1,,bbox_text
PAR-DOC-BMK-002-00247,DOC-BMK-002,20,11,heading,"6. The implementation of the specific programme referred to in point (a) of Article 1(2) and the EIT's KICs shall be supported by a transparent and strategic planning of R&I activities as laid down in the specific programme referred to in point (a) of Article 1(2), in particular for the pillar 'Global Challenges and European Industrial Competitiveness' and cover also relevant activities in other pillars and the 'Widening participation and strengthening the ERA' part.",5,1,,bbox_text
PAR-DOC-BMK-002-00248,DOC-BMK-002,20,12,paragraph,"The Commission shall ensure the early involvement of Member States and extensive exchanges with the European Parliament, to be complemented by consultations with stakeholders and the general public.",2,1,,bbox_text
PAR-DOC-BMK-002-00249,DOC-BMK-002,20,13,paragraph,"Strategic planning shall ensure alignment with other relevant Union programmes and consistency with Union priorities and commitments and increase complementarity and synergies with national and regional funding programmes and priorities, thereby strengthening the ERA. Areas for possible missions and areas for possible Institutionalised European Partnerships shall be established in Annex VI.",4,1,,bbox_text
