paragraph_id,document_id,page_no,page_block_order,block_type,text,source_line_count,merged_block_count,normalization_actions,source_mode
PAR-DOC-BMK-002-00001,DOC-BMK-002,1,1,paragraph,EN Official Journal of the European Union,2,1,,bbox_text
PAR-DOC-BMK-002-00002,DOC-BMK-002,1,2,heading,12.5.2021 L 170/1,2,1,,bbox_text
PAR-DOC-BMK-002-00003,DOC-BMK-002,1,3,paragraph,I (Legislative acts),2,2,merged_continuation,bbox_text
PAR-DOC-BMK-002-00004,DOC-BMK-002,1,4,paragraph,REGULATIONS,1,1,,bbox_text
PAR-DOC-BMK-002-00005,DOC-BMK-002,1,5,paragraph,"REGULATION (EU) 2021/695 OF THE EUROPEAN PARLIAMENT AND OF THE COUNCIL of 28 April 2021 establishing Horizon Europe – the Framework Programme for Research and Innovation, laying down its rules for participation and dissemination, and repealing Regulations (EU) No 1290/2013 and (EU) No 1291/2013 (Text with EEA relevance) THE EUROPEAN PARLIAMENT AND THE COUNCIL OF THE EUROPEAN UNION, Having regard to the Treaty on the Functioning of the European Union, and in particular Article 173(3), Article 182(1), Article 183, and the second paragraph of Article 188 thereof, Having regard to the proposal from the European Commission, After transmission of the draft legislative act to the national parliaments, Having regard to the opinions of the European Economic and Social Committee (1), Having regard to the opinion of the Committee of the Regions (2), Acting in accordance with the ordinary legislative procedure (3), Whereas:",15,12,merged_continuation|merged_continuation|merged_continuation|merged_continuation|merged_continuation|merged_continuation|merged_continuation|merged_continuation|merged_continuation|merged_continuation|merged_continuation,bbox_text
PAR-DOC-BMK-002-00006,DOC-BMK-002,1,6,paragraph,"(1) It is an objective of the Union to strengthen its scientific and technological bases by strengthening the European research area (ERA) in which researchers, scientific knowledge and technology circulate freely and encouraging it to become more competitive, including in its industry, while promoting all research and innovation (R&I) activities to deliver on the Union's strategic priorities and commitments, which ultimately aim to promote peace, the Union's values and the well-being of its peoples.",6,1,,bbox_text
PAR-DOC-BMK-002-00007,DOC-BMK-002,1,7,paragraph,"(2) To deliver scientific, technological, economic, environmental and societal impact in pursuit of this general objective and to maximise the added value of the Union's R&I investments, the Union should invest in R&I through Horizon Europe - the Framework Programme for Research and Innovation 2021-2027 (the 'Programme'). The Programme should support the creation, better diffusion and transfer of high-quality and excellent knowledge and high-quality technologies in the Union, attract talent at all levels and contribute to full engagement of the Union's talent pool, facilitate collaborative links and strengthen the impact of R&I in developing, supporting and implementing Union policies, support and strengthen the uptake and deployment of innovative and sustainable solutions in the Union's economy, in particular in small and medium-sized enterprises (SMEs), and in society, address global challenges, including climate change and the United Nations Sustainable Development Goals (SDGs), create jobs, boost economic growth, promote industrial competitiveness and boost the attractiveness of the Union in the field of R&I. The Programme should foster all forms of innovation, including breakthrough innovation, foster market deployment of innovative solutions, and optimise the delivery of such investment for increased impact within a strengthened ERA.",14,1,,bbox_text
PAR-DOC-BMK-002-00008,DOC-BMK-002,1,8,paragraph,"(1) OJ C 62, 15.2.2019, p. 33 and OJ C 364, 28.10.2020, p. 124. (2) OJ C 461, 21.12.2018, p. 79. (3) Position of the European Parliament of 17 April 2019 (not yet published in the Official Journal) and position of the Council at first reading of 16 March 2021 (not yet published in the Official Journal). Position of the European Parliament of … (not yet published in the Official Journal).",5,1,,bbox_text
PAR-DOC-BMK-002-00009,DOC-BMK-002,2,1,paragraph,EN Official Journal of the European Union L 170/2,3,1,,bbox_text
PAR-DOC-BMK-002-00010,DOC-BMK-002,2,2,heading,12.5.2021,1,1,,bbox_text
PAR-DOC-BMK-002-00011,DOC-BMK-002,2,3,paragraph,"(3) The Programme should be established for the duration of the multiannual financial framework (MFF) 2021-2027 as laid down in Council Regulation (EU, Euratom) 2020/2093 (4), without prejudice to the time limits set out in Council Regulation (EU) 2020/2094 (5).",4,1,,bbox_text
PAR-DOC-BMK-002-00012,DOC-BMK-002,2,4,paragraph,"(4) The Programme should contribute to increasing public and private investment in R&I in Member States, thereby helping to reach an overall investment target of at least 3 % of the Union's gross domestic product (GDP) in research and development. Achieving that target would require Member States and the private sector to complement the Programme with their own reinforced investment actions in research, development and innovation.",5,1,,bbox_text
PAR-DOC-BMK-002-00013,DOC-BMK-002,2,5,paragraph,"(5) With a view to achieving the objectives of the Programme and while respecting the principle of excellence, the Programme should aim to strengthen, among other things, collaborative links in Europe thereby contributing to reducing the R&I divide.",4,1,,bbox_text
PAR-DOC-BMK-002-00014,DOC-BMK-002,2,6,paragraph,"(6) To help achieve Union policy objectives, activities supported under this Programme should, where relevant, take advantage of and inspire innovation-friendly regulation, in line with the innovation principle, to support a faster and more intensive transformation of the Union's substantial knowledge assets into innovation.",4,1,,bbox_text
PAR-DOC-BMK-002-00015,DOC-BMK-002,2,7,paragraph,"(7) The concepts of 'open science', 'open innovation' and 'open to the world' should ensure excellence and the impact of the Union's investment in R&I, while safeguarding the Union's interests.",3,1,,bbox_text
PAR-DOC-BMK-002-00016,DOC-BMK-002,2,8,paragraph,"(8) Open science, including open access to scientific publications and research data, as well as optimal dissemination and exploitation of knowledge have the potential to increase the quality, impact and benefits of science. They also have the potential to accelerate the advancement of knowledge by making it more reliable, efficient and accurate, more easily understood by society and responsive to societal challenges. Provisions should be laid down to ensure that beneficiaries provide open access to peer-reviewed scientific publications. Likewise, it should be ensured that beneficiaries provide open access to research data following the principle 'as open as possible, as closed as necessary', while ensuring the possibility of exceptions taking into account the legitimate interests of the beneficiaries. More emphasis should in particular be given to the responsible management of research data, which should comply with the principles of 'findability', 'accessibility', 'interoperability' and 'reusability' (the 'FAIR principles'), in particular through the mainstreaming of data management plans. Where appropriate, beneficiaries should make use of the possibilities offered by the European Open Science Cloud (EOSC) and the European Data Infrastructure and adhere to further open science principles and practices. Reciprocity in open science should be encouraged in all association and cooperation agreements with third countries.",14,1,,bbox_text
PAR-DOC-BMK-002-00017,DOC-BMK-002,2,9,paragraph,"(9) Beneficiaries of the Programme, especially SMEs, are to be encouraged to make use of the relevant existing Union's instruments, such as the European IP Helpdesk that supports SMEs and other participants in the Programme in both protecting and enforcing their intellectual property (IP) rights.",4,1,,bbox_text
PAR-DOC-BMK-002-00018,DOC-BMK-002,2,10,paragraph,"(10) The conception and design of the Programme should respond to the need for establishing a critical mass of supported activities throughout the Union, encouraging excellence-based participation of all Member States, and through international cooperation, in line with the 2030 Agenda for Sustainable Development (the '2030 Agenda'), the SDGs and the Paris Agreement adopted under the United Nations Framework Convention on Climate Change (6) (the 'Paris Agreement'). Programme implementation should reinforce the pursuit of the SDGs and the commitment of the Union and its Member States to implementing the 2030 Agenda to achieving its three dimensions – economic, social and environmental – in a coherent and integrated manner.",8,1,,bbox_text
PAR-DOC-BMK-002-00019,DOC-BMK-002,2,11,paragraph,"(11) Activities supported under the Programme should contribute towards the achievement of the Union's objectives, priorities and international commitments.",3,1,,bbox_text
PAR-DOC-BMK-002-00020,DOC-BMK-002,2,12,paragraph,"(4) Council Regulation (EU, Euratom) 2020/2093 of 17 December 2020 laying down the multiannual financial framework for the years 2021 to 2027 (OJ L 433 I, 22.12.2020, p. 11). (5) Council Regulation (EU) 2020/2094 of 14 December 2020 establishing a European Union Recovery Instrument to support the recovery in the aftermath of the COVID-19 crisis (OJ L 433 I, 22.12.2020, p. 23). (6) OJ L 282, 19.10.2016, p. 4.",5,1,,bbox_text
PAR-DOC-BMK-002-00021,DOC-BMK-002,3,1,paragraph,EN Official Journal of the European Union,2,1,,bbox_text
PAR-DOC-BMK-002-00022,DOC-BMK-002,3,2,heading,12.5.2021 L 170/3,2,1,,bbox_text
PAR-DOC-BMK-002-00023,DOC-BMK-002,3,3,paragraph,"(12) The Programme should benefit from complementarity with existing relevant European R&I roadmaps and strategies, as well as with important projects of common European interest (IPCEIs), where relevant, provided that related R&I needs are identified in the Programme's strategic planning.",4,1,,bbox_text
PAR-DOC-BMK-002-00024,DOC-BMK-002,3,4,paragraph,"(13) The Programme should ensure transparency and accountability of public funding in R&I projects, thereby preserving the public interest.",3,1,,bbox_text
PAR-DOC-BMK-002-00025,DOC-BMK-002,3,5,paragraph,"(14) The Programme should support R&I activities in the field of social sciences and humanities (SSH). This entails advancing scientific knowledge in that domain and making use of insights and progress from SSH to increase the economic and societal impact of the Programme. Under the pillar 'Global Challenges and European Industrial Competitiveness', SSH should be fully integrated across all clusters. Beyond the promotion of SSH in projects, the integration of SSH should also be supported through the inclusion, whenever appropriate, of independent external experts from the field of SSH in expert committees and evaluation panels, and through timely monitoring and reporting of SSH in funded research actions. In particular, the level of mainstreaming of SSH should be monitored across the Programme.",9,1,,bbox_text
PAR-DOC-BMK-002-00026,DOC-BMK-002,3,6,paragraph,"(15) The Programme should maintain a balanced approach between research on the one hand and innovation on the other, as well as between bottom-up funding (investigator or innovator driven) and top-down funding (determined by strategically defined priorities), by reference to the nature of the R&I communities that are engaged across the Union, the types and purpose of the activities carried out and the impacts that are sought. The mix of those factors should determine the choice of approach for the relevant parts of the Programme, all of which contribute to all general and specific objectives of the Programme.",7,1,,bbox_text
PAR-DOC-BMK-002-00027,DOC-BMK-002,3,7,paragraph,"(16) The overall budget for the 'widening participation and spreading excellence' component of the 'Widening Participation and Strengthening the ERA' part of the Programme should be at least 3,3 % of the overall Programme budget and should mainly benefit legal entities established in the widening countries.",4,1,,bbox_text
PAR-DOC-BMK-002-00028,DOC-BMK-002,3,8,paragraph,"(17) Excellence initiatives should aim to strengthen R&I excellence in the eligible countries, including supporting training to improve R&I managerial skills, prizes, strengthening innovation ecosystems as well as the creation of R&I networks, including on the basis of research infrastructures financed by the Union. Applicants should clearly show that projects are linked with national and/or regional R&I strategies to be eligible to apply for funding under the 'widening participation and spreading excellence' component of the 'Widening Participation and Strengthening the ERA' part of the Programme.",7,1,,bbox_text
PAR-DOC-BMK-002-00029,DOC-BMK-002,3,9,paragraph,"(18) It should be possible to apply a fast track to R&I procedure, where time-to-grant should not exceed six months, to allow for faster, bottom-up access to funds for small collaborative consortia covering actions from fundamental research to market application.",4,1,,bbox_text
PAR-DOC-BMK-002-00030,DOC-BMK-002,3,10,paragraph,"(19) The Programme should support all stages of R&I especially within collaborative projects and in missions and European Partnerships, as appropriate. Fundamental research is an essential asset of and an important condition for increasing the Union's ability to attract the best scientists in order to become a global hub of excellence. A balance between basic and applied research should be ensured in the Programme. Coupled with innovation, that balance will support the Union's economic competitiveness, growth and jobs.",6,1,,bbox_text
PAR-DOC-BMK-002-00031,DOC-BMK-002,3,11,paragraph,"(20) Evidence shows that embracing diversity, in all senses, is key to doing good science, as science benefits from diversity. Diversity and inclusiveness contribute to excellence in collaborative R&I: collaboration across disciplines, sectors and throughout the ERA makes for better research and higher quality project proposals, can lead to higher rates of societal take-up and can foster the benefits of innovation, thus advancing Europe.",5,1,,bbox_text
PAR-DOC-BMK-002-00032,DOC-BMK-002,3,12,paragraph,"(21) In order to maximise the impact of the Programme, particular consideration should be given to multidisciplinary, interdisciplinary and transdisciplinary approaches as key elements for major scientific progress.",3,1,,bbox_text
PAR-DOC-BMK-002-00033,DOC-BMK-002,4,1,paragraph,EN Official Journal of the European Union L 170/4,3,1,,bbox_text
PAR-DOC-BMK-002-00034,DOC-BMK-002,4,2,heading,12.5.2021,1,1,,bbox_text
PAR-DOC-BMK-002-00035,DOC-BMK-002,4,3,paragraph,"(22) Research activities carried out under the pillar 'Excellent Science' should be determined according to the needs and opportunities of science and should promote scientific excellence. The research agenda should be set in close liaison with the scientific community and include emphasis on attracting new R&I talents, early stage researchers, while strengthening the ERA, avoiding brain drain and promoting brain circulation.",5,1,,bbox_text
PAR-DOC-BMK-002-00036,DOC-BMK-002,4,4,paragraph,"(23) The Programme should support the Union and its Member States in attracting the best talents and skills, taking into account the reality of very intense international competition.",3,1,,bbox_text
PAR-DOC-BMK-002-00037,DOC-BMK-002,4,5,paragraph,"(24) The pillar 'Global Challenges and European Industrial Competitiveness' should be established through clusters of R&I activities, in order to maximise integration across the respective thematic areas while securing high and sustainable levels of impact for the Union in relation to the resources that are expended. It would encourage cross-disciplinary, cross-sectoral, cross-policy and cross-border collaboration in pursuit of the SDGs by following the principles of the 2030 Agenda, the Paris Agreement and the competitiveness of the Union's industries. The organisation of high- ambition, wide-scale initiatives in the form of R&I missions would enable the Programme to achieve a transformative and systemic impact for society in support of the SDGs, also through international cooperation and science diplomacy. The activities under that pillar should cover the full range of R&I activities to ensure that the Union remains at the cutting-edge in strategically defined priorities.",10,1,,bbox_text
PAR-DOC-BMK-002-00038,DOC-BMK-002,4,6,paragraph,"(25) The cluster 'Culture, Creativity and Inclusive Society' should contribute substantially to the research on cultural and creative sectors, including on the Union's cultural heritage and in particular allowing the establishment of a European cultural heritage collaborative space.",4,1,,bbox_text
PAR-DOC-BMK-002-00039,DOC-BMK-002,4,7,paragraph,"(26) Full and timely engagement of all types of industry in the Programme, from individual entrepreneurs and SMEs to large scale enterprises, would substantially contribute to the realisation of the objectives of the Programme and specifically towards the creation of sustainable jobs and growth in the Union. Such engagement by the industry should see its participation in the actions supported at levels at least commensurate with those under the framework programme Horizon 2020 established by Regulation (EU) No 1291/2013 of the European Parliament and of the Council (7) (Horizon 2020).",7,1,,bbox_text
PAR-DOC-BMK-002-00040,DOC-BMK-002,4,8,paragraph,"(27) Actions under the Programme would substantially contribute towards unlocking the potential of the Union's strategic sectors, including key enabling technologies that reflect the Union's industrial policy strategy objectives.",3,1,,bbox_text
PAR-DOC-BMK-002-00041,DOC-BMK-002,4,9,paragraph,"(28) Multi-stakeholder consultations, including of civil society and industry, should contribute to the perspectives and priorities established through the strategic planning. This should result in periodic strategic R&I plans adopted by means of implementing acts for preparing the content of work programmes.",4,1,,bbox_text
PAR-DOC-BMK-002-00042,DOC-BMK-002,4,10,paragraph,"(29) For a particular action to be funded, the work programme should take into account the outcome of specific previous projects as well as the state of science, technology and innovation at national, Union and international level and of the relevant policy, market and societal developments.",4,1,,bbox_text
PAR-DOC-BMK-002-00043,DOC-BMK-002,4,11,paragraph,"(30) It is important to support the Union's industry in remaining or in becoming a world leader in innovation, digitisation and climate neutrality, in particular through investments in key enabling technologies that will underpin tomorrow's business. The Programme's actions should address market failures or sub-optimal investment situations, boost investments in a proportionate and transparent manner, without duplicating or crowding out private financing and have a clear European added value and public return on investments. This will ensure consistency between the actions of the Programme and Union State aid rules, in order to incentivise innovation and avoid undue distortions of competition in the internal market.",8,1,,bbox_text
PAR-DOC-BMK-002-00044,DOC-BMK-002,4,12,paragraph,"(7) Regulation (EU) No 1291/2013 of the European Parliament and of the Council of 11 December 2013 establishing Horizon 2020 - the Framework Programme for Research and Innovation (2014-2020) and repealing Decision No 1982/2006/EC (OJ L 347, 20.12.2013, p. 104).",3,1,,bbox_text
PAR-DOC-BMK-002-00045,DOC-BMK-002,5,1,paragraph,EN Official Journal of the European Union,2,1,,bbox_text
PAR-DOC-BMK-002-00046,DOC-BMK-002,5,2,heading,12.5.2021 L 170/5,2,1,,bbox_text
PAR-DOC-BMK-002-00047,DOC-BMK-002,5,3,paragraph,"(31) The Programme should support R&I in an integrated manner, respecting all relevant provisions in the framework of the World Trade Organization. The concept of research, including experimental development, should be used in accordance with the Frascati Manual developed by the Organisation for Economic Co-operation and Development (OECD), whereas the concept of innovation should be used in accordance with the Oslo Manual developed by the OECD and Eurostat, which follows a broad approach that covers social innovation and design. As in Horizon 2020, the OECD definitions regarding technological readiness levels (TRLs) should continue to be taken into account in the classification of technological research, product development and demonstration activities, and in the definition of types of action available in calls for proposals. Grants should not be awarded for actions where activities go above TRL 8. It should be possible for the work programme to allow grants for large-scale product validation and market replication for a given call under the pillar 'Global Challenges and European Industrial Competitiveness'.",11,1,,bbox_text
PAR-DOC-BMK-002-00048,DOC-BMK-002,5,4,paragraph,(32) The Programme should contribute to space objectives at a level of spending that is at least proportionally commensurate with that under Horizon 2020.,3,1,,bbox_text
PAR-DOC-BMK-002-00049,DOC-BMK-002,5,5,paragraph,"(33) The Commission communication of 11 January 2018 entitled 'Horizon 2020 interim evaluation: maximising the impact of EU research and innovation', the resolution of the European Parliament of 13 June 2017 on the assessment of Horizon 2020 implementation in view of its interim evaluation and the Framework Programme 9 proposal (8) and the Council Conclusions of 1 December 2017 entitled 'From the Interim Evaluation of Horizon 2020 towards the ninth Framework Programme' have provided a set of recommendations for the Programme, including for its rules for participation and dissemination. Those recommendations build on the lessons learnt from Horizon 2020 as well as input from Union institutions and stakeholders. Those recommendations include the proposal of measures to promote brain circulation and facilitate openness of R&I networks to invest more ambitiously in order to reach critical mass and maximise impact; to support breakthrough innovation; to prioritise Union R&I investments in areas of high added value, in particular through mission-orientation, full, well-informed and timely citizen involvement and wide communication; to rationalise the Union funding landscape in order to fully use the R&I potential, including research infrastructures across the Union, such as by streamlining the range of European Partnership initiatives and co-funding schemes; to develop more and concrete synergies between different Union funding instruments, in particular by overcoming non-complementary intervention logics and complexity of the various funding and other regulations also with the aim of helping to mobilise under-exploited R&I potential across the Union; to strengthen international cooperation and reinforce openness to third countries' participation; and to continue simplification based on implementation experiences of Horizon 2020.",18,1,,bbox_text
PAR-DOC-BMK-002-00050,DOC-BMK-002,5,6,paragraph,"(34) Given that special attention needs to be paid to coordination and complementarity between different Union policies, the Programme should seek synergies with other Union programmes, from their design and strategic planning, to project selection, management, communication, dissemination and exploitation of results, monitoring, auditing and governance. Regarding funding for R&I activities, synergies should allow for the harmonisation of rules, including cost eligibility rules, as much as possible. With a view to avoiding duplication or overlaps, to increasing the leverage of Union funding and to decreasing the administrative burden for applicants and beneficiaries, it should be possible to promote synergies, in particular by alternative, combined, cumulative funding and transfers of resources.",8,1,,bbox_text
PAR-DOC-BMK-002-00051,DOC-BMK-002,5,7,paragraph,"(35) In accordance with Regulation (EU) 2020/2094 and within the limits of the resources allocated therein, recovery and resilience measures under the Programme should be carried out to address the unprecedented consequences of the COVID-19 crisis. Such additional resources should be used in such a way as to ensure compliance with the time limits provided for in Regulation (EU) 2020/2094. Such additional resources should be allocated exclusively to actions for R&I directed at addressing the consequences of the COVID-19 crisis and in particular its economic, social and societal consequences.",7,1,,bbox_text
PAR-DOC-BMK-002-00052,DOC-BMK-002,5,8,paragraph,"(36) In order for Union funding to have the greatest possible impact and to make the most effective contribution to the Union's policy objectives and commitments, it should be possible for the Union to enter into European Partnerships with private and/or public sector partners. Such partners include industry, SMEs, universities, research organisations, R&I stakeholders, bodies with a public service mission at local, regional, national or international level or civil society organisations, including foundations and non-governmental organisations (NGOs) that support and/or carry out R&I, provided that the desired impacts can be achieved more effectively in partnership than by the Union alone.",7,1,,bbox_text
PAR-DOC-BMK-002-00053,DOC-BMK-002,5,9,paragraph,"(8) OJ C 331, 18.9.2018, p. 30.",1,1,,bbox_text
PAR-DOC-BMK-002-00054,DOC-BMK-002,6,1,paragraph,EN Official Journal of the European Union L 170/6,3,1,,bbox_text
PAR-DOC-BMK-002-00055,DOC-BMK-002,6,2,heading,12.5.2021,1,1,,bbox_text
